ASIN,NID,RID,NAME,PRICE,CATEGORY,BRAND,AMAZON_INFO,NEWEGG_INFO,AMAZON_NUM_REVIEWS,NEWEGG_NUM_REVIEWS,AMAZON_RATING_1,AMAZON_RATING_2,AMAZON_RATING_3,AMAZON_RATING_4,AMAZON_RATING_5,AMAZON_RATING_AVGB00CZ6JG8O,N82E16811353002,11-353-002,diypc alpha-gt3 black acrylic and aluminum atx bench case bench computer case for atx/micro atx motherboard – pc components not included,57.48,Computer Cases,diypc,14.9 x 12.1 x 12.1 inches 6.7 pounds 7.8 pounds     diypc b00cz6jg8o imported  china  alpha-gt3 4.2 out of 5 stars may 24  2013 none none,alpha-gt3,4,81,0,0,25,25,50,4.25B00D19HE1U,N82E16833320091,33-320-091,asus rt-n66u dual-band wireless-n900 gigabit router  dd-wrt open source support  ieee 802.11a/b/g/n  ieee 802.3/3u/3ab | dual band wireless n900 ultra thin 2.4/5ghz,87.25,Wireless Routers,asus,12 x 3.5 x 9.5 inches 3 pounds 3 pounds asus computer b00d19he1u rt-n66u 5.0 out of 5 stars april 22  2012 none none,rt-n66u,9,872,0,0,0,0,100,5B00D3Y7P44,N82E16811353001,11-353-001,diypc alpha-db6 black acrylic atx bench case bench computer case for atx/micro atx motherboard – pc components not included,46.31,Computer Cases,diypc,17.4 x 7.4 x 10.4 inches 3.3 pounds 5.3 pounds     diypc b00d3y7p44 imported  china  alpha-db6 4.0 out of 5 stars may 31  2013 none none,alpha-db6,15,51,0,0,33,33,34,4.01B00D5XAN06,N82E16820233538,20-233-538,corsair vengeance pro 16gb  2 x 8gb  240-pin ddr3 sdram ddr3 1600  pc3 12800  desktop memory model cmy16gx3m2a1600c9r  red  | series dram 1600mhz c9 kit,112.99,Memory,corsair,5.3 x 1.7 x 2.4 inches 1.8 ounces 2.9 ounces corsair b00d5xan06 made in usa or imported cmy16gx3m2a1600c9r 4.1 out of 5 stars august 15  2013 none none,cmy16gx3m2a1600c9r,20,77,5,10,0,5,80,4.45B00D5ZZZFC,9SIABRA4T47768,19-116-963,intel pentium g2140 ivy bridge dual-core 3.3 ghz lga 1155 55w bx80637g2140 desktop processor intel hd graphics | 3.30ghz,87,CPUs,intel,b00d5zzzfc 5.0 out of 5 stars 11.4 ounces     item can be shipped within u.s. this item is not eligible for international shipping. june 3  2013 3.3 ghz pentium intel bx80637g2140 10.4 ounces 4.6 x 4.4 x 3.3 inches 4.6 x 4.4 x 3.3 inches intel 2 ddr3 sdram,bx80637g2140,1,2,0,0,0,0,100,5B00D5ZZZMU,9SIABB74HH5945,19-116-923,intel core i3-3245 ivy bridge dual-core 3.4 ghz lga 1155 55w bx80637i33245 desktop processor intel hd graphics 4000 | 3.40ghz 2,121.45,CPUs,intel,b00d5zzzmu 4.7 out of 5 stars 10.4 ounces     item can be shipped within u.s. this item is not eligible for international shipping. june 3  2013 3.4 ghz intel core i3 intel bx80637i33245 10.4 ounces 4.6 x 4.4 x 3.3 inches 4.6 x 4.4 x 3.3 inches intel 2 ddr3 sdram,bx80637i33245,11,7,0,0,0,9,91,4.91B00D695GS8,N82E16822165544,22-165-544,buffalo 1tb ministation external hard drive usb 3.0 model hd-pcf1.0u3bb black | 1 tb portable,78.1,External Harddrives,buffalo,b00d695gs8 4.5 out of 5 stars 2.5 pounds     item can be shipped within u.s. this item can be shipped to select countries outside of the u.s. june 4  2013 1 tb portable buffalo hd-pcf1.0u3bb hd-pcf1.0u3bb pc  mac 10.2 ounces 5 x 6.7 x 1.8 inches 5.04 x 6.7 x 1.8 inches black 5 volts,hd-pcf1.0u3bb,244,2,7,3,5,16,69,4.37B00D78Q2AO,9SIA91J43P3869,33-122-555,netgear r6100-100pas ac1200 dual band r6100 wi-fi router ieee 802.11ac  ieee 802.11a/b/g/n | fast ethernet w/usb 2.0,91.69,Wireless Routers,netgear,b00d78q2ao 3.8 out of 5 stars 1.9 pounds     currently  item can be shipped only within the u.s. and to apo/fpo addresses. for apo/fpo shipments  please check with the manufacturer regarding warranty and support issues. this item can be shipped to select countries outside of the u.s. june 17  2013 802.11 a/b/g/n 1 netgear r6100-100pas 1.9 pounds 11.4 x 10.2 x 3 inches 11.42 x 10.24 x 2.95 inches,r6100-100pas,300,40,18,10,7,16,49,3.68B00D7S1CCM,N82E16833320167,33-320-167,asus rt-ac56u ac1200 dual-band gigabit wireless router | wl-router,107.35,Wireless Routers,asus,5.8 x 2.6 x 8.1 inches 14.4 ounces 2.6 pounds     asus b00d7s1ccm 90ig0060-bm3g20 3.0 out of 5 stars june 26  2013 none none,rt-ac56u,1,73,0,0,100,0,0,3B00DES2FQW,N82E16833320167,33-320-167,asus ac1200 wireless dual band  5ghz + 2.4ghz  gigabit router  rt-ac56u  802.11ac 1167 mbps wi-fi speed  4x gigabit lan ports  aiprotection security  aicloud file sharing  airadar beamforming | dual-band,95.71,Wireless Routers,asus,b00des2fqw 4.2 out of 5 stars 2.4 pounds     june 14  2013 802.11 a/c asus rt-ac56u n/a 14.4 ounces 3.2 x 10.9 x 12.5 inches 3.25 x 10.9 x 12.5 inches black ddr3 sdram ac,rt-ac56u,349,73,15,6,7,13,59,3.95B00DGHD2TA,N82E16819113346,19-113-346,amd fx-9370 vishera 8-core 4.4 ghz socket am3+ 220w fd9370fhhkbof desktop processor - black edition | fd9370fhhkwof fx-series,174.99,CPUs,amd,b00dghd2ta 4.3 out of 5 stars 2.4 ounces     item can be shipped within u.s. this item is not eligible for international shipping. july 15  2013 4.4 ghz fx-series eight-core fx-8100 amd fd9370fhhkwof 2.7 ounces 1 x 8.9 x 5.7 inches 1 x 8.9 x 5.7 inches amd 8 ddr3 sdram,fd9370fhhkwof,111,128,7,3,8,12,70,4.35B00DH9M3C4,N82E16820231672,20-231-672,g.skill ripjaws x series 16gb  2 x 8gb  240-pin ddr3 sdram ddr3 2400  pc3 19200  desktop memory model f3-2400c11d-16gxm,110.95,Memory,g.skill,3.9 x 2 x 0.8 inches 4.2 ounces 4.2 ounces     g.skill b00dh9m3c4 made in usa or imported f3-2400c11d-16gxm 4.4 out of 5 stars june 25  2013 none none,f3-2400c11d-16gxm,28,75,4,7,0,7,82,4.56B00DHAD3JU,9SIA4RE4ZW5502,26-436-020,roccat kone pure optical roc-11-710 black 7 buttons usb wired optical gaming mouse | core performance,62.49,Mice,roccat,b00dhad3ju 4.0 out of 5 stars 10.6 ounces july 24  2013 802.11 a/b/g/n roccat roc-11-710 pc 8 ounces 4.7 x 2.8 x 2.8 inches 4.72 x 2.75 x 2.75 inches black,roc-11-710,62,10,6,2,13,13,66,4.31B00DKXXAAQ,9SIA4RE4Y37904,23-129-030,cooler master devastator - led gaming keyboard and mouse combo bundle  blue edition  | cm storm,42.99,Gaming Keyboards,cooler master,b00dkxxaaq 4.1 out of 5 stars 3.1 pounds item can be shipped within u.s. this item is not eligible for international shipping. june 22  2013 cooler master sgb-3010-kkmf1-us pc windows 2 pounds 17.7 x 5.8 x 1.4 inches 17.7 x 5.8 x 1.4 inches blue none,sgb-3010-kkmf1-us,3375,761,6,7,12,25,50,4.06B00DLYD31A,9SIA8VD3KG2411,33-124-503,linksys ac900 wi-fi wireless dual-band+ router  smart wi-fi app enabled to control your network from anywhere  ea6200  | dual band,21,Wireless Routers,linksys,b00dlyd31a 3.7 out of 5 stars 1.9 pounds item can be shipped within u.s. this item is not eligible for international shipping. july 1  2013 802.11 a/c 1 linksys ea6200 windows 7 windows 8 mac 1.9 pounds 12.4 x 2.6 x 9.2 inches 12.36 x 2.56 x 9.25 inches ac,ea6200,236,50,22,8,9,18,43,3.52B00DOP3NPW,9SIA4RE4S37136,26-735-068,mee audio matrix2 bluetooth wireless + wired high fidelity headphones with headset and aptx  aac  and nfc support | air-fi af62 stereo functionality,79.39,Headphones,mee audio,7 x 3 x 7 inches 7.5 ounces 13.6 ounces     unisex-adult s2e inc b00dop3npw made in usa or imported hp-af62-cf-mee 1 lithium ion batteries required. 4.0 out of 5 stars june 25  2013 none none,hp-af62-cf-mee,659,13,8,8,8,20,56,4.08B00DOV1948,9SIA0AJ2MH2159,28-112-482,samsung ml-2165w/xac wireless monochrome laser printer,127.3,Laser Printers,samsung,7 x 13 x 8.5 inches 8.8 pounds 10.8 pounds item can be shipped within u.s. this item is not eligible for international shipping. b00dov1948 ml-2165w/xac 3.9 out of 5 stars june 24  2013 none none,ml-2165w/xac,466,18,18,9,9,17,47,3.66B00DOV1COK,9SIA0AJ2KT8040,28-112-478,samsung sl-m2625d/xac monochrome laser printer,227.19,Laser Printers,samsung,13.2 x 14.5 x 8 inches 16.4 pounds 20.6 pounds     item can be shipped within u.s. this item is not eligible for international shipping. b00dov1cok sl-m2625d/xac 3.7 out of 5 stars june 24  2013 none none,sl-m2625d/xac,78,16,20,5,5,21,49,3.74B00DQ5RGOY,9SIABB74AK2666,23-239-024,steelseries apex gaming keyboard,85.6,Gaming Keyboards,steelseries,b00dq5rgoy 4.1 out of 5 stars 5 pounds     item can be shipped within u.s. this item can be shipped to select countries outside of the u.s. july 15  2013 2 steelseries 64145 pc windows  mac os 2.9 pounds 8.7 x 22.1 x 2 inches 8.66 x 22.05 x 2.05 inches black,64145,482,46,11,8,11,21,49,3.89B00DQDSJPG,9SIA0FU42N7983,0B1-00K1-00012,siig dp soundwave dual profile pci-express 7.1-channel sound card ic-710211-s1 | pcie 7.1 ch,51.38,Sound Cards,siig,b00dqdsjpg 3.4 out of 5 stars 6.4 ounces     item can be shipped within u.s. this item is not eligible for international shipping. july 1  2013 siig ic-710211-s1 1.9 ounces 0.7 x 4.7 x 3.5 inches 0.71 x 4.72 x 3.54 inches none,ic-710211-s1,6,0,16,17,0,17,50,3.68B00DQDSJPG,9SIA0ZX1BK5009,29-270-014,siig dp soundwave dual profile pci-express 7.1-channel sound card ic-710211-s1 | 7.1 channels pci interface,49.77,Sound Cards,siig,b00dqdsjpg 3.4 out of 5 stars 6.4 ounces     item can be shipped within u.s. this item is not eligible for international shipping. july 1  2013 siig ic-710211-s1 1.9 ounces 0.7 x 4.7 x 3.5 inches 0.71 x 4.72 x 3.54 inches none,ic-710211-s1,6,1,16,17,0,17,50,3.68B00DR7EG0I,9SIA0AJ2RS2701,33-122-615,refurbished  netgear ac1450 dual band gigabit smart wifi router two  2  usb ports—one usb 3.0 and one usb 2.0 port ieee 802.11 b/g/n 2.4 ghz ieee 802.11 a/n/ac 5.0 ghz five  5  10/100/1000  1 wan and 4 lan  gigabi,124.24,Wireless Routers,netgear,b00dr7eg0i 3.4 out of 5 stars 2.1 pounds     currently  item can be shipped only within the u.s. and to apo/fpo addresses. for apo/fpo shipments  please check with the manufacturer regarding warranty and support issues. this item is not eligible for international shipping. july 3  2013 802.11 a/b/g/n  802.11 a/b  802.11a netgear ac1450 2 pounds 11.9 x 10.1 x 3 inches 11.9 x 10.1 x 3 inches black,ac1450,47,32,40,17,2,13,28,2.72B00DR8LB4Q,9SIABMT4MW8011,26-104-927,logitech m560 910-003880 black tilt wheel usb rf wireless optical mouse | -,30.48,Mice,logitech,b00dr8lb4q 4.0 out of 5 stars 7.2 ounces     item can be shipped within u.s. this item can be shipped to select countries outside of the u.s. september 13  2013 802.11abg logitech 910-003880 windows 8  windows 7 5.3 ounces 5.9 x 3.6 x 8.5 inches 5.91 x 3.58 x 8.46 inches black aa 1 aa batteries required.  included ,910-003880,858,13,9,10,11,21,49,3.91B00E055H5O,9SIA4T01GT5698,22-236-568, old model  wd my passport ultra 2 tb portable external usb 3.0 hard drive with auto backup  black | 2tb wdbmwv0020bbk-nesn,156.99,External Harddrives,western digital,b00e055h5o 4.5 out of 5 stars 12.8 ounces     currently  item can be shipped only within the u.s. and to apo/fpo addresses. for apo/fpo shipments  please check with the manufacturer regarding warranty and support issues. this item can be shipped to select countries outside of the u.s. july 19  2013 2 tb 2 tb portable 7025-01-624-1465 western digital wdbmwv0020bbk-nesn pc 8 ounces 0.8 x 3.2 x 4.3 inches 0.82 x 3.23 x 4.35 inches black,wdbmwv0020bbk-nesn,12116,38,7,2,3,13,75,4.47B00E0FOCUA,N82E16811147184,11-147-184,rosewill galaxy-02 - black gaming atx mid tower computer case - top-mounted usb 3.0 port  three fans included - 1 x front blue led 120mm  1 x rear 120mm  1 x top 120mm,50.35,Computer Cases,rosewill,b00e0focua 3.8 out of 5 stars 12.2 pounds     item can be shipped within u.s. this item can be shipped to select countries outside of the u.s. july 18  2013 2 1 rosewill galaxy-02 12.1 pounds 15.6 x 7.3 x 16.3 inches 15.55 x 7.28 x 16.26 inches 1,galaxy-02,32,90,6,3,13,25,53,4.16B00E0LCRE2,9SIA12K0F13305,0BD-000B-00011,sandisk cruzer fit 16 gb usb flash drive sdcz33-016g-b35  5 pack  w/  2  everything but stromboli  tm  lanyard | 32gb 32g 2.0 with free,28.52,USB Flash Drives,sandisk,0.5 x 0.3 x 0.7 inches 1 ounces 1.6 ounces     sandisk & everything but stromboli ltd. b00e0lcre2 sdcz33-016g-b35-2pk 4.4 out of 5 stars july 18  2013 none none,sdcz33-016g-b35,36,11,8,0,6,19,67,4.37B00E0LCRE2,9SIA7HK3YM3831,20-171-588,sandisk cruzer fit 16 gb usb flash drive sdcz33-016g-b35  5 pack  w/  2  everything but stromboli  tm  lanyard | 16gb 2.0 model,26.43,USB Flash Drives,sandisk,0.5 x 0.3 x 0.7 inches 1 ounces 1.6 ounces     sandisk & everything but stromboli ltd. b00e0lcre2 sdcz33-016g-b35-2pk 4.4 out of 5 stars july 18  2013 none none,sdcz33-016g-b35,36,34,8,0,6,19,67,4.37B00E0P7JFA,N82E16811147183,11-147-183,rosewill galaxy-01 - black gaming atx mid tower computer case - three fans included  up to four fans supported  top-mounted usb 3.0 port,43.44,Computer Cases,rosewill,b00e0p7jfa 4.3 out of 5 stars 12.6 pounds     item can be shipped within u.s. this item is not eligible for international shipping. july 18  2013 2 1 rosewill galaxy-01 10.1 pounds 18.5 x 8 x 18.6 inches 18.5 x 8 x 18.63 inches black 1,galaxy-01,134,104,4,4,9,18,65,4.36B00E3RH5W2,9SIA3TB1JE6631,22-236-628,western digital 2 tb usb 3.0 my book desktop external hard drive  wdbfjk0020hbk-nesn   | wd 2tb - -,113.5,External Harddrives,western digital,b00e3rh5w2 4.5 out of 5 stars 2.9 pounds item can be shipped within u.s. this item is not eligible for international shipping. september 24  2013 2 tb external western digital wdbfjk0020hbk-nesn wdbfjk0020hbk-nesn 2 pounds 5.5 x 4.7 x 6.7 inches 5.5 x 4.72 x 6.7 inches black,wdbfjk0020hbk-nesn,548,22,7,2,4,16,71,4.42B00E3RH5W2,9SIA57Z2P08571,1E8-0006-000E8,refurbished  wd my book 2tb usb 3.0 hard drive w/ security & local & cloud backup - black | western digital 2 tb desktop external wdbfjk0020hbk-nesn,44.99,External Harddrives,western digital,b00e3rh5w2 4.5 out of 5 stars 2.9 pounds item can be shipped within u.s. this item is not eligible for international shipping. september 24  2013 2 tb external western digital wdbfjk0020hbk-nesn wdbfjk0020hbk-nesn 2 pounds 5.5 x 4.7 x 6.7 inches 5.5 x 4.72 x 6.7 inches black,wdbfjk0020hbk-nesn,548,0,7,2,4,16,71,4.42B00E3RH63A,9SIA85V48D5487,22-236-627,western digital 3 tb usb 3.0 my book desktop external hard drive  wdbfjk0030hbk-nesn  | wd 3tb - -,115.19,External Harddrives,western digital,b00e3rh63a 4.3 out of 5 stars 2.8 pounds item can be shipped within u.s. this item is not eligible for international shipping. september 24  2013 3 tb desktop western digital wdbfjk0030hbk-nesn wdbfjk0030hbk-nesn pc 2.2 pounds 5.5 x 4.7 x 6.7 inches 5.5 x 4.72 x 6.7 inches black ac,wdbfjk0030hbk-nesn,1031,28,9,3,4,16,68,4.31B00E3W16OU,9SIAADF3YT4138,20-147-251,"samsung 840 evo 2.5"" 1tb sata iii mlc internal solid state drive  ssd  mz-7te1t0bw | 2.5-inch",562.97,Internal SSDs,samsung,b00e3w16ou 4.7 out of 5 stars 6.4 ounces     item can be shipped within u.s. this item is not eligible for international shipping. august 12  2013 2.5 inches 1 tb samsung mz-7te1t0bw pc 1.9 ounces 3.9 x 2.8 x 0.3 inches 3.94 x 2.75 x 0.28 inches titanium 1000,mz-7te1t0bw,7759,188,3,1,2,9,85,4.72B00E4MQODC,9SIA4RE38P6972,26-104-914,logitech g602 910-003820 black 11 buttons 1 x wheel usb rf wireless optical gaming mouse | with 250 hour battery life,48.99,Mice,logitech,b00e4mqodc 4.3 out of 5 stars 15.2 ounces     item can be shipped within u.s. this item can be shipped to select countries outside of the u.s. august 27  2013 5.8 ghz radio frequency  802.11 a/b/g/n logitech logitech g602 mouse 910-003820 pc mac mac os x snow leopard  windows vista  windows 8  windows 7  windows 10 15.2 ounces 5.5 x 3.3 x 1.7 inches 5.47 x 3.27 x 1.73 inches black  grey aa battery 2 aa batteries required.  included ,910-003820,2153,152,6,5,7,16,66,4.31B00E4MQODC,N82E16826104938,26-104-938,refurbished  logitech g602 black rf wireless optical gaming mouse  910-003820  | with 250 hour battery life,37.49,Mice,logitech,b00e4mqodc 4.3 out of 5 stars 15.2 ounces     item can be shipped within u.s. this item can be shipped to select countries outside of the u.s. august 27  2013 5.8 ghz radio frequency  802.11 a/b/g/n logitech logitech g602 mouse 910-003820 pc mac mac os x snow leopard  windows vista  windows 8  windows 7  windows 10 15.2 ounces 5.5 x 3.3 x 1.7 inches 5.47 x 3.27 x 1.73 inches black  grey aa battery 2 aa batteries required.  included ,910-003820,2153,21,6,5,7,16,66,4.31B00EELU4ES,9SIA9JA4Y61799,28-415-813,hp laserjet pro m127fw  cz183a  up to 21 ppm 600 x 600 dpi monochrome usb/ethernet/wireless all-in-one laser printer | wireless,267.94,Laser Printers,hp,14.4 x 16.5 x 12.2 inches 0.2 ounces 17.4 pounds item can be shipped within u.s. this item is not eligible for international shipping. b00eelu4es m127fw 4.1 out of 5 stars october 19  2013 none none,m127fw,285,8,13,8,7,16,56,3.94B00EF1G9D2,9SIA85V4SA9885,19-116-941,intel core i7-4771 haswell quad-core 3.5ghz  3.9ghz turbo  lga 1150 84w bx80646i74771 desktop processor intel hd graphics 4600 | 3.5 3,369.35,CPUs,intel,b00ef1g9d2 4.3 out of 5 stars 11.4 ounces item can be shipped within u.s. this item is not eligible for international shipping. august 17  2013 3.5 ghz intel core i7 1740 mb intel bx80646i74771 6.1 ounces 9.5 x 5.6 x 6 inches 9.5 x 5.6 x 6 inches intel 4 ddr3 sdram,bx80646i74771,43,69,2,0,5,12,81,4.7B00EF1G9DW,9SIA6ZP4MT9644,19-116-950,intel pentium g3220 haswell dual-core 3.0 ghz lga 1150 54w bx80646g3220 desktop processor intel hd graphics,110.32,CPUs,intel,b00ef1g9dw 4.6 out of 5 stars 12 ounces     september 1  2013 3 ghz intel pentium dual-core 1740 mb intel bx80646g3220 6.4 ounces 9.5 x 5.6 x 6 inches 9.5 x 5.6 x 6 inches intel 2 ddr3 sdram,bx80646g3220,118,156,1,0,6,10,83,4.74B00EGSGDXK,9SIA9DE3SA7183,22-136-771,"western digital blue wd2500aakx 250gb 7200 rpm 16mb cache sata 6.0gb/s 3.5"" internal hard drive bare drive | caviar 3.5",32.84,Internal Harddrives,western digital,8 x 6 x 4 inches 1 pounds 1 pounds     wd b00egsgdxk wd2500aakx - 9 4.9 out of 5 stars august 11  2013 none none,wd2500aakx,12,202,0,0,0,8,92,4.92B00EIQTKAS,N82E16822178380,22-178-380,"seagate hybrid drive  st2000dx001 2tb mlc/8gb 64mb cache sata 6.0gb/s ncq 3.5"" desktop sshd | 3.5-inch 6gb/s old model",97.49,Internal Harddrives,seagate,b00eiqtkas 4.3 out of 5 stars 1.4 pounds     item can be shipped within u.s. this item is not eligible for international shipping. august 15  2013 3.5 inches 2 gb serial ata-600 seagate seagate  disty  st2000dx001 pc 1.4 pounds 5.8 x 4 x 1 inches 5.79 x 4 x 1.03 inches silver serial ata-600 1 rpm,st2000dx001,2314,293,10,3,5,15,67,4.26B00ELNG49I,9SIA66T3MZ1252,23-114-047,razer blackwidow stealth edition expert mechanical gaming keyboard,77.99,Gaming Keyboards,razer,b00elng49i 3.9 out of 5 stars 5.2 pounds item can be shipped within u.s. this item is not eligible for international shipping. march 10  2014 razer rz03-00393600-r3m1 pc windows 3.4 pounds 18.5 x 1.5 x 7.2 inches 18.52 x 1.53 x 7.17 inches none,rz03-00393600-r3m1,105,7,11,5,11,19,54,4B00EM71W1S,N82E16820233569,20-233-569,corsair 64gb voyager mini usb 3.0 flash drive  cmfmini3-64gb ,30.77,USB Flash Drives,corsair,b00em71w1s 3.6 out of 5 stars 0.3 ounces     item can be shipped within u.s. this item can be shipped to select countries outside of the u.s. august 20  2013 64 gb corsair cmfmini3-64gb pc  mac 0.5 ounces 3.9 x 0.4 x 4.5 inches 3.94 x 0.39 x 4.53 inches black  gray,cmfmini3-64gb,260,32,19,11,10,17,43,3.54B00EMHM6JK,9SIAAEE5B48660,19-116-938,intel core i7-4960x ivy bridge-e 6-core 3.6ghz  turbo 4ghz  lga 2011 130w bx80633i74960x desktop processor | extreme edition processors,2754.99,CPUs,intel,b00emhm6jk 4.8 out of 5 stars 3.2 ounces     item can be shipped within u.s. this item can be shipped to select countries outside of the u.s. september 10  2013 3.6 ghz intel core i7 intel bx80633i74960x 1.6 ounces 9.5 x 5.6 x 6 inches 9.5 x 5.6 x 6 inches intel 6 ddr3 sdram,bx80633i74960x,25,23,0,0,4,0,96,4.92B00EO6X4XG,9SIA85V3TA5065,23H-001X-00004,creative sound blaster audigy fx pcie 5.1 sound card with high performance headphone amp,45.48,Sound Cards,creative,b00eo6x4xg 4.0 out of 5 stars 8.8 ounces     item can be shipped within u.s. this item can be shipped to select countries outside of the u.s. august 20  2013 creative sb1570 6.4 ounces 5.4 x 4.8 x 0.7 inches 5.43 x 4.76 x 0.71 inches 1 ddr3 sdram 1 none,sb1570,759,1,12,6,8,15,59,4.03B00EON40CS,N82E16817438014,17-438-014,evga 600 b1  80+ bronze 600w  3 year warranty  includes free power on self tester  power supply 100-b1-0600-kr,49.99,Power Supplies,evga,b00eon40cs 4.5 out of 5 stars 5.1 pounds     august 29  2013 evga 100-b1-0600-kr 5.1 pounds 5.5 x 5.9 x 3.4 inches 5.51 x 5.91 x 3.35 inches black 220 volts none,100-b1-0600-kr,2434,214,6,2,3,11,78,4.53B00EOTYZOA,N82E16820231705,20-231-705,g.skill ripjaws series 16gb  2 x 8g  204-pin ddr3 so-dimm ddr3l 1600  pc3l 12800  laptop memory model f3-1600c9d-16grsl | 1.35v dual-channel,102.99,Memory,g.skill,3.9 x 3.1 x 0.8 inches 1.1 ounces 1.1 ounces     g.skill b00eotyzoa f3-1600c9d-16grsl 4.7 out of 5 stars august 27  2013 none none,f3-1600c9d-16grsl,56,171,2,0,4,5,89,4.79B00EOUFEG2,N82E16820231704,20-231-704,g.skill ripjaws series 8gb 204-pin ddr3 so-dimm ddr3l 1600  pc3l 12800  laptop memory model f3-1600c9s-8grsl | pc3,55.69,Memory,g.skill,5.5 x 1.6 x 0.4 inches 0.3 ounces 0.3 ounces     g.skill b00eoufeg2 523515 4.8 out of 5 stars august 27  2013 none none,f3-1600c9s-8grsl,18,117,0,0,0,11,89,4.89B00EPGKA4G,N82E16822205200,22-205-200,g-technology g-speed q high-performance 4-bay raid storage solution 16tb  usb3.0/esata/firewire 800   0g02840  | usb 3.0 / 2 x firewire800 / esata array silver,1499.95,External Harddrives,g-technology,b00epgka4g 4.5 out of 5 stars 15.8 pounds     item can be shipped within u.s. this item is not eligible for international shipping. september 1  2004 16 tb external 1 g-technology 0g02840 12.5 pounds 8.6 x 4.8 x 6.6 inches 8.62 x 4.85 x 6.63 inches silver 7200 rpm,0g02840,2,0,0,0,0,50,50,4.5B00ESUIX4S,N82E16822301016,22-301-016,silicon power 1tb rugged armor a30 shockproof standard 2.5-inch usb 3.0 military grade  portable external hard drive black | model sp010tbphda30s3k,61.49,External Harddrives,silicon power,b00esuix4s 4.4 out of 5 stars 9.8 ounces     item can be shipped within u.s. this item can be shipped to select countries outside of the u.s. august 27  2013 1 tb portable silicon power sp010tbphda30s3k pc  mac 9.8 ounces 5.3 x 3.4 x 0.7 inches 5.3 x 3.4 x 0.7 inches black,sp010tbphda30s3k,1680,8,7,2,2,12,77,4.5B00EUUKVXM,9SIAAEE4XU5003,19-116-946,intel core i3-4130 haswell dual-core 3.4 ghz lga 1150 54w bx80646i34130 desktop processor intel hd graphics 4400 | 3 fclga,216,CPUs,intel,b00euukvxm 4.5 out of 5 stars 9.9 ounces     september 4  2013 3.4 ghz intel core i3 intel bx80646i34130 9.9 ounces 9.5 x 5.6 x 6 inches 9.5 x 5.6 x 6 inches intel 2,bx80646i34130,91,99,1,0,2,11,86,4.81B00EUUN76U,9SIA85V4R41864,19-116-945,intel core i3-4330 haswell dual-core 3.5 ghz lga 1150 54w bx80646i34330 desktop processor intel hd graphics 4600 | dual 2 na,273.01,CPUs,intel,b00euun76u 4.3 out of 5 stars 10.9 ounces     item can be shipped within u.s. this item is not eligible for international shipping. september 4  2013 3.5 ghz intel core i3 1740 mb intel bx80646i34330 10.4 ounces 4.6 x 4.4 x 3.2 inches 4.6 x 4.4 x 3.2 inches intel 2,bx80646i34330,46,54,4,0,0,11,85,4.73B00EUVMICS,9SIAAEE4TV2345,19-116-943,intel core i5-3340 ivy bridge quad-core 3.1ghz  3.3ghz turbo  lga 1155 77w bx80637i53340 desktop processor intel hd graphics | 6m cache up to 3.30 ghz -,218.5,CPUs,intel,b00euvmics 5.0 out of 5 stars 12.8 ounces     item can be shipped within u.s. this item is not eligible for international shipping. september 4  2013 3.1 ghz intel core i5 intel bx80637i53340 3.2 ounces 4.5 x 4.3 x 3.3 inches 4.5 x 4.3 x 3.3 inches intel 5,bx80637i53340,2,2,0,0,0,0,100,5B00EUZVNHU,N82E16811139027,11-139-027,corsair graphite series 230t cc-9011038-ww orange on black with orange led fans atx mid tower computer case | window compact mid-tower,77.49,Computer Cases,corsair,b00euzvnhu 4.4 out of 5 stars 6.4 ounces     october 15  2013 2 corsair cc-9011038-ww 6.4 ounces 19.9 x 8.3 x 17.3 inches 19.9 x 8.3 x 17.3 inches rebel orange black 1,cc-9011038-ww,276,66,2,1,5,26,66,4.53B00EVVNMQI,9SIA4RE54D3400,26-254-047,tt esports theron infrared mo-trn006dtm black 8 buttons 1 x wheel usb wired optical gaming mouse | thermaltake,52.26,Mice,tt esports,b00evvnmqi 3.9 out of 5 stars 15.2 ounces     item can be shipped within u.s. this item can be shipped to select countries outside of the u.s. august 28  2013 802.11abg tt esports mo-trn006dtm pc 1 pounds 9.5 x 2.5 x 6.5 inches 9.5 x 2.5 x 6.5 inches infrared,mo-trn006dtm,26,7,4,4,11,19,62,4.31B00EWEHI5K,9SIA4RE4030767,26-153-128,razer ouroboros elite ambidextrous wired or wireless gaming mouse - 8200 dpi 4g laser sensor,135,Mice,razer,b00ewehi5k 3.9 out of 5 stars 1.8 pounds     item can be shipped within u.s. this item can be shipped to select countries outside of the u.s. august 27  2013 802.11 a/b/g/n razer rz01-00770300-r331 rz01-00770300-r331 pc windows 6.4 ounces 4.8 x 3.7 x 1.5 inches 4.82 x 3.7 x 1.54 inches black nickel-metal hydride  nimh  1 aa batteries required.  included ,rz01-00770300-r331,485,99,13,10,12,14,51,3.8