ASIN,NID,RID,NAME,PRICE,CATEGORY,BRAND,AMAZON_INFO,NEWEGG_INFO,AMAZON_NUM_REVIEWS,NEWEGG_NUM_REVIEWS,AMAZON_RATING_1,AMAZON_RATING_2,AMAZON_RATING_3,AMAZON_RATING_4,AMAZON_RATING_5,AMAZON_RATING_AVGB00005ARK3,9SIA0AJ0NA7913,33-124-002,linksys befw11s4 wireless router ieee 802.3/3u  ieee 802.11b | cisco-linksys wireless-b cable/dsl,49.98,Wireless Routers,linksys,8.2 x 7.2 x 2.1 inches 2.5 pounds 2.5 pounds b00005ark3 befw11s4 3.4 out of 5 stars may 2  2006 none none,befw11s4,1108,69,20,11,8,20,41,3.51B00005LLY4,9SIA5AD4YZ4354,22-136-292,"refurbished  western digital blue wd800bb 80gb 7200 rpm 2mb cache ide ultra ata100 / ata-6 3.5"" hard drive bare drive | udma/100 7200rpm",37.74,Internal Harddrives,western digital,5.8 x 4 x 1 inches 1.3 pounds 1.3 pounds     western digital b00005lly4 imported  thailand  wd800bb 7025-01-499-4377 7025-01-502-8221 4.0 out of 5 stars january 17  2006 none none,wd800bb,159,97,16,8,5,19,52,3.83B00005LLY4,9SIAAEE3XR1053,22-144-102,"western digital caviar wd800bb 80gb 7200 rpm 2mb cache ide ultra ata100 / ata-6 3.5"" internal hard drive bare drive | udma/100 7200rpm",32.25,Internal Harddrives,western digital,5.8 x 4 x 1 inches 1.3 pounds 1.3 pounds     western digital b00005lly4 imported  thailand  wd800bb 7025-01-499-4377 7025-01-502-8221 4.0 out of 5 stars january 17  2006 none none,wd800bb,159,506,16,8,5,19,52,3.83B00005QBUU,9SIA0AJ0ZB3820,26-159-210,sony mdr-e818lp fontopia ear-bud headphones with acoustic twin turbo circuit  discontinued by manufacturer  | - bud style,49.85,Headphones,sony,3.9 x 10 x 3.9 inches 4 ounces 1.4 ounces     sony b00005qbuu item can be shipped within u.s. this item is not eligible for international shipping. mdre818lp 1 lithium ion batteries required. 3.7 out of 5 stars yes october 2  2001 none none,mdr-e818lp,284,16,10,8,8,23,51,3.97B00005TQ08,9SIA4RE38E5766,26-105-115,microsoft intellimouse optical mouse,20.07,Mice,microsoft,9.5 x 8.9 x 2.1 inches 11.2 ounces 11.2 ounces b00005tq08 d58-00026 4.1 out of 5 stars november 6  2001 none none,d58-00026,293,55,4,4,4,16,72,4.48B00006HNZ1,9SIA67S2MJ6064,22-140-118,"western digital caviar wd400bb 40gb 7200 rpm 2mb cache ide ultra ata100 / ata-6 3.5"" hard drive bare drive | 7200rpm bulk/oem",50.95,Internal Harddrives,western digital,5.5 x 4 x 1 inches 2 pounds 1.5 pounds     item can be shipped within u.s. this item can be shipped to select countries outside of the u.s. b00006hnz1 wd400bb 7025-01-499-6464 4.1 out of 5 stars yes august 29  2002 none none,wd400bb,33,220,12,18,3,21,46,3.71B00007056H,9SIA7HN2M96288,26-106-363,koss ktxpro1 titanium portable headphones with volume control | stereo headphone,19.45,Headphones,koss,10.2 x 7.2 x 2 inches 4 ounces 7 ounces     electronics koss b00007056h imported  china  ktxpro1 4.3 out of 5 stars october 2  2001 none none,ktxpro1,1516,14,4,6,9,22,59,4.26B000070G4C,9SIA67S2MJ6064,22-140-118,"western digital caviar wd400bb 40gb 7200 rpm 2mb cache ide ultra ata100 / ata-6 3.5"" hard drive bare drive | 7200rpm bulk/oem",50.94,Internal Harddrives,western digital,5.7 x 3.9 x 1 inches 2 pounds 1.3 pounds     western digital b000070g4c wd400bb-rtl2 4.2 out of 5 stars may 7  2007 none none,wd400bb,13,220,0,8,8,15,69,4.45B00008SCFL,9SIA0AJ3598363,33-122-016,netgear wgr614 802.11b/g wireless-g broadband router up to 54mbps/ 10/100 mbps ethernet port x4,59.73,Wireless Routers,netgear,1.1 x 6.9 x 4.9 inches 1 pounds 1.1 pounds     b00008scfl wgr614na 3.9 out of 5 stars march 8  2003 none none,wgr614,1279,792,26,9,7,19,39,3.36B000093S8Z,9SIA5AD4YZ4354,22-136-292,"refurbished  western digital blue wd800bb 80gb 7200 rpm 2mb cache ide ultra ata100 / ata-6 3.5"" hard drive bare drive | 7200rpm bulk/oem 3.5 inch desktop",14.99,Internal Harddrives,western digital,5.8 x 4 x 1 inches 1 pounds 1.3 pounds item can be shipped within u.s. this item is not eligible for international shipping. b000093s8z wd800bb 7025-01-499-4377 7025-01-502-8221 4.1 out of 5 stars april 28  2004 none none,wd800bb,83,97,15,6,1,7,71,4.13B000093S8Z,9SIAAEE3XR1053,22-144-102,"western digital caviar wd800bb 80gb 7200 rpm 2mb cache ide ultra ata100 / ata-6 3.5"" internal hard drive bare drive | 7200rpm bulk/oem 3.5 inch desktop",9.5,Internal Harddrives,western digital,5.8 x 4 x 1 inches 1 pounds 1.3 pounds item can be shipped within u.s. this item is not eligible for international shipping. b000093s8z wd800bb 7025-01-499-4377 7025-01-502-8221 4.1 out of 5 stars april 28  2004 none none,wd800bb,83,506,15,6,1,7,71,4.13B00009RDIF,9SIA76D4RS9354,26-181-012,panasonic over-the-ear stereo headphones rp-ht227  black & silver  integrated volume controller  travel-fold design | headphone,20.27,Headphones,panasonic,7 x 2 x 2 inches 1 pounds 7.2 ounces panasonic english b00009rdif item can be shipped within u.s. this item is not eligible for international shipping. rpht227 3.9 out of 5 stars may 20  2003 none none,rp-ht227,559,12,9,7,14,23,47,3.92B0000AKGPB,9SIA9AX4SS5695,23H-000F-00061,refurbished  creative labs sound blaster live! 5.1 pci sb0200 sound card 0r533,8.1,Sound Cards,creative,6.6 x 6.6 x 1.6 inches 12 ounces 14.4 ounces creative b0000akgpb 70sb022200007 2.6 out of 5 stars january 7  2006 none none,sb0200,12,0,17,0,17,33,33,3.65B0000CD0BU,9SIA4RE4VX3655,23H-0035-00002,refurbished  creative sound blaster x-fi xtrememusic 7.1 channels 24-bit 96khz pci interface sound card | labs audigy2 zs platinum internal 70sb035000003,54.49,Sound Cards,creative,14.7 x 9.2 x 3.8 inches 3.2 pounds 3.2 pounds item can be shipped within u.s. this item is not eligible for international shipping. b0000cd0bu 70sb035000003 7050-01-530-7395 3.8 out of 5 stars august 28  2003 none none,platinum,15,0,13,13,7,13,54,3.82B0000CG4DI,9SIA4RE4XA9790,29-102-178,creative sound blaster audigy2 zs sb0350 7.1 channels pci interface sound card | labs audigy 2 internal,56,Sound Cards,creative,7.5 x 5.1 x 1.7 inches 3 pounds 1.6 pounds item can be shipped within u.s. this item is not eligible for international shipping. b0000cg4di sb0350 3.4 out of 5 stars september 11  2003 none none,sb0350,60,311,13,8,12,17,50,3.83B0001D3K8A,9SIA0AJ3ZC0154,33-124-136,linksys wrt54gs wireless-g broadband router with speedbooster ieee 802.3/3u  ieee 802.11b/g | cisco-linksys,57.19,Wireless Routers,linksys,1.9 x 7.3 x 7.9 inches 1.1 pounds 2.3 pounds b0001d3k8a wrt54gs 3.9 out of 5 stars yes march 7  2005 none none,wrt54gs,749,301,16,6,7,19,52,3.85B0002F8578,9SIAAEE48J6992,22-144-309,"western digital caviar se wd2500jb 250gb 7200 rpm 8mb cache eide 3.5"" hard drive bare drive | 250 gb",22.99,Internal Harddrives,western digital,4 x 6 x 2 inches 1.6 pounds 1.6 pounds     item can be shipped within u.s. this item is not eligible for international shipping. b0002f8578 wd2500jb 7025-01-536-2533 7025-01-538-4031 4.1 out of 5 stars june 29  2004 none none,wd2500jb,129,336,11,4,8,15,62,4.13B0002IP2TY,9SIA4RE54V1825,20-145-086,crucial 1gb ddr 333mhz  pc2700  unbuffered  non-ecc  184-pin dimm desktop memory upgrade ct12864z335 | sdram 333 pc 2700 model,22.74,Memory,crucial,5.2 x 0.1 x 1.2 inches 0.3 ounces 0.3 ounces     item can be shipped within u.s. this item is not eligible for international shipping. b0002ip2ty ct12864z335 4.5 out of 5 stars june 25  2004 none none,ct12864z335,164,265,2,0,3,9,86,4.77B0006B486K,9SIA7HN2M98202,26-106-720,koss ksc75 portable sportclip stereophone earphone | headphones,17.27,Headphones,koss,6.5 x 2.5 x 6.5 inches 1.4 ounces 2.9 ounces     unisex-adult koss b0006b486k made in usa or imported for proposition 65 warning 155540 5965-01-572-9399 3.9 out of 5 stars january 23  2005 none none,ksc75,2426,74,8,10,11,23,48,3.93B0007N55NM,9SIA0AJ17S4938,26-159-223,sony mdr-xd100 stereo headphones  discontinued by manufacturer  | - studio monitor series,97.95,Headphones,sony,9.8 x 7.5 x 3.8 inches 12 ounces 12 ounces     sony b0007n55nm item can be shipped within u.s. this item is not eligible for international shipping. imported  thailand  mdrxd100 3.5 out of 5 stars yes october 2  2001 none none,mdr-xd100,316,92,11,11,16,24,38,3.67B00080DSEM,9SIA1N82853897,26-105-166,microsoft compact optical mouse 500 - black,11.59,Mice,microsoft,3.4 x 1.9 x 1 inches 4 ounces 4 ounces     b00080dsem u81-00009 4.1 out of 5 stars june 6  2005 none none,u81-00009,83,26,11,5,11,26,47,3.93B00081S0YY,9SIA6ZP49F8502,26-106-953,koss td85 home stereo headphone | stereophones,36.26,Headphones,koss,11 x 7.6 x 4.2 inches 1.2 pounds 1.1 pounds     china b00081s0yy 155532 3.7 out of 5 stars none none,td85,20,12,5,20,15,30,30,3.6B000DT7ZJM,9SIA4RE54X1870,20-145-048,crucial 1gb ddr2-667  pc2-5300  200-pin sodimm cl=5 unbuffered non-ecc laptop memory - ct12864ac667 | ddr2 so-dimm ddr2 667 pc2 5300 model,15.5,Memory,crucial,3.9 x 2 x 0.8 inches 0.3 ounces 0.3 ounces     b000dt7zjm ct12864ac667 4.4 out of 5 stars november 1  2004 none none,ct12864ac667,115,343,8,2,4,11,75,4.43B000F2BP7U,N82E16826242002,26-242-002,3m ergonomic mouse  optical  usb/ps2 compatible  small size  black  em500gps  | 3 buttons usb,62.03,Mice,3m,b000f2bp7u 3.9 out of 5 stars 10.7 ounces     item can be shipped within u.s. this item can be shipped to select countries outside of the u.s. march 3  2004 3m 3m ergonomic mouse em500gps pc 10.6 ounces 5.2 x 5.4 x 5.4 inches 5.2 x 5.4 x 5.4 inches black none,em500gps,509,8,7,10,11,22,50,3.98B000FQ2JLW,N82E16820148086,20-148-086,crucial 2gb  2 x 1gb  200-pin ddr2 so-dimm ddr2 667  pc2 5300  dual channel kit laptop memory model ct2kit12864ac667 | 1gbx2 667mhz pc2-5300 cl5 sodimm notebook modules,29.39,Memory,crucial,7 x 0.4 x 5 inches 1.1 ounces 1.4 ounces     b000fq2jlw ct2kit12864ac667 4.7 out of 5 stars july 7  2004 none none,ct2kit12864ac667,642,684,2,1,4,10,83,4.71B000GOUE7O,9SIA4RE2SX1293,26-105-188,microsoft intellimouse explorer 3.0 optical mouse  dark gray,20.73,Mice,microsoft,9.5 x 8.2 x 2 inches 13.9 ounces 12 ounces b000goue7o b75-00113 3.7 out of 5 stars september 14  2004 none none,b75-00113,210,67,11,6,13,11,59,4.01B000HJ98M0,9SIA85V3R95237,35-150-071,masscool 70mm sleeve cpu cooler  5t568s1h3 ,15.14,CPU Fans and Heatsinks,masscool,b000hj98m0 3.3 out of 5 stars 0.3 ounces     april 2  2004 masscool 5t568s1h3 0.3 ounces 4 x 3.2 x 3.2 inches 4 x 3.25 x 3.25 inches black none,5t568s1h3,8,60,37,0,12,13,38,3.15B000I4UQFC,9SIA7XZ39J1103,26-105-053,microsoft 4ch-00012 aluminium 5 buttons 1 x wheel usb bluetooth wireless laser mouse 8000,179.99,Mice,microsoft,9.2 x 9.2 x 3.5 inches 1.6 pounds 1.6 pounds     currently  item can be shipped only within the u.s. and to apo/fpo addresses. for apo/fpo shipments  please check with the manufacturer regarding warranty and support issues. this item is not eligible for international shipping. b000i4uqfc 4ch-00012 3.9 out of 5 stars yes july 7  2004 none none,4ch-00012,83,43,15,10,8,25,42,3.69B000IJY8DS,N82E16812189136,12-189-136,link depot hdmi-25-hdmi 25 ft black high speed hdmi to hdmi a/v cable - oem | feet,8.75,HDMI Cables,link depot,10 x 2 x 10 inches 2.4 ounces 2.4 ounces     link depot b000ijy8ds imported  china  for proposition 65 warning hdmi-25-hdmi 4.1 out of 5 stars october 2  2001 none none,hdmi-25-hdmi,4062,108,13,4,5,11,67,4.15B000JJR8I4,N82E16820134192,20-134-192,kingston valueram 2gb 240-pin ddr2 sdram ddr2 667  pc2 5300  desktop memory model kvr667d2n5/2g | 667mhz non-ecc cl5 dimm,24.67,Memory,kingston,6.2 x 1.8 x 0.2 inches 0.8 ounces 0.6 ounces     b000jjr8i4 kvr667d2n5/2g 7025-01-570-6774 4.6 out of 5 stars january 20  2007 none none,kvr667d2n5/2g,182,161,5,4,3,12,76,4.5B000JREMTO,9SIA0FU42J2262,20-134-513,kingston 2gb 200-pin ddr2 so-dimm ddr2 667  pc2 5300  laptop memory model kvr667d2s5/2g | valueram 667mhz non-ecc cl5 sodimm notebook,25.98,Memory,kingston,2.7 x 0.1 x 1.2 inches 8 ounces 0.6 ounces     b000jremto kvr667d2s5/2g 4.3 out of 5 stars december 6  2006 none none,kvr667d2s5/2g,100,130,3,3,4,10,80,4.61B000KA7PD0,9SIA4RE59X5793,26-105-051,microsoft natural wireless laser mouse 6000,92.88,Mice,microsoft,9.6 x 9.4 x 3.6 inches 1.5 pounds 1.1 pounds b000ka7pd0 69k-00001 3.9 out of 5 stars june 17  2003 none none,69k-00001,289,50,14,13,11,21,41,3.62B000LRMR26,9SIA6393S22280,1B4-00PR-00065,refurbished  intel core 2 quad q6600 2.40ghz 8m l2 cache quad-core processor lga 775 desktop cpu | 2.40 ghz,73.54,CPUs,intel,7 x 4 x 7 inches 1.2 pounds 1.4 pounds     intel b000lrmr26 imported  usa  bx80562q6600 5998-01-579-9190 5895-01-585-6587 4.6 out of 5 stars yes august 9  2006 none none,q6600,188,2,3,1,1,10,85,4.73B000MX7Z0S,9SIA0AJ12J7202,26-159-098,sony clip-on stereo headphones with double retractable cord   mdr-q68lw s silver  japanese imports  | 3.5mm gold-plated connector headphone,55.27,Headphones,sony,8.7 x 2.8 x 1.2 inches 1.4 ounces 3.5 ounces     sony b000mx7z0s mdr-q68lw s  4.1 out of 5 stars june 27  2012 none none,mdr-q68lw,27,11,8,0,11,33,48,4.13B000MX7Z12,9SIA0AJ12J7202,26-159-098,sony clip-on stereo headphones with double retractable cord   mdr-q68lw b black  japanese imports  | 3.5mm gold-plated connector headphone,54.8,Headphones,sony,8.6 x 2.7 x 1.3 inches 1.4 ounces 3.5 ounces     sony b000mx7z12 imported  japan  mdr-q68lw b  4.3 out of 5 stars june 27  2012 none none,mdr-q68lw,84,11,8,3,5,23,61,4.26B000MX7Z1C,9SIA0AJ12J7202,26-159-098,sony clip-on stereo headphones with double retractable cord   mdr-q68lw w white  japanese imports  | 3.5mm gold-plated connector headphone,55.38,Headphones,sony,4.1 x 2.8 x 1.4 inches 1.4 ounces 1.1 pounds     sony b000mx7z1c imported  japan  mdr-q68lw w  4.6 out of 5 stars june 27  2012 none none,mdr-q68lw,21,11,0,0,0,29,71,4.71B000MX7Z1M,9SIA0AJ12J7202,26-159-098,sony clip-on stereo headphones with double retractable cord   mdr-q68lw l blue  japanese imports  | 3.5mm gold-plated connector headphone,54.67,Headphones,sony,8.6 x 3.1 x 1.5 inches 1.4 ounces 1.8 ounces     sony b000mx7z1m imported  japan  mdr-q68lw l  4.0 out of 5 stars june 27  2012 none none,mdr-q68lw,64,11,6,6,5,19,64,4.29B000MX7Z1W,9SIA0AJ12J7202,26-159-098,sony clip-on stereo headphones with double retractable cord   mdr-q68lw r red  japanese imports  | 3.5mm gold-plated connector headphone,54.97,Headphones,sony,8.6 x 2.4 x 1.4 inches 1.4 ounces 3.5 ounces     sony b000mx7z1w imported  japan  mdr-q68lw r  4.1 out of 5 stars june 27  2012 none none,mdr-q68lw,16,11,6,0,13,31,50,4.19B000MX7Z26,9SIA0AJ12J7202,26-159-098,sony clip-on stereo headphones with double retractable cord   mdr-q68lw t brown  japanese imports  | 3.5mm gold-plated connector headphone,53.77,Headphones,sony,8.7 x 2.8 x 1.4 inches 1.4 ounces 3.5 ounces     sony b000mx7z26 mdr-q68lw t  4.2 out of 5 stars june 27  2012 none none,mdr-q68lw,3,11,0,0,33,33,34,4.01B000OCUS7Y,9SIA45H22W2054,35-150-083,masscool 90mm ball cpu cooler 8w553b1m3,14.62,CPU Fans and Heatsinks,masscool,b000ocus7y 3.8 out of 5 stars 12.8 ounces     item can be shipped within u.s. this item can be shipped to select countries outside of the u.s. april 2  2004 masscool 8w553b1m3 1 pounds 4 x 4 x 3.5 inches 4 x 4 x 3.5 inches none,8w553b1m3,17,264,12,6,0,23,59,4.11B000PCF7A6,9SIA0AJ12J7202,26-159-098,sony mdr-q68lw 3.5mm gold-plated connector clip-on headphone with retractable cord | style,79.95,Headphones,sony,9.7 x 4 x 1.5 inches 0.8 ounces 1.4 ounces     sony b000pcf7a6 this item can only be shipped to the 48 contiguous states. we regret it cannot be shipped to apo/fpo  hawaii  alaska  or puerto rico. this item is not eligible for international shipping. mdrq68lw 4.2 out of 5 stars october 2  2001 none none,mdr-q68lw,453,11,4,8,10,29,49,4.11B000PEHZ9K,9SIAAEE48J6992,22-144-309,"western digital caviar se wd2500jb 250gb 7200 rpm 8mb cache eide 3.5"" hard drive bare drive | udma/100 7200rpm ide",22.99,Internal Harddrives,western digital,8.3 x 6.5 x 4.8 inches 1.6 pounds 1.6 pounds     western digital b000pehz9k imported  thailand  wd2500jb 7025-01-536-2533 7025-01-538-4031 4.1 out of 5 stars november 5  2007 none none,wd2500jb,35,336,9,3,6,11,71,4.32B000PMGZDO,9SIA4RE46N7167,20-148-201,crucial 4gb kit  2gbx2  ddr2 667mhz  pc2-5300  cl5 sodimm 200-pin notebook memory modules ct2kit25664ac667 / ct2cp25664ac667 | 2 x 2gb so-dimm 667 pc2 5300 laptop model,35.25,Memory,crucial,2.6 x 1.2 inches 1.4 ounces 1.4 ounces     b000pmgzdo ct2kit25664ac667 4.7 out of 5 stars april 22  2007 none none,ct2kit25664ac667,849,187,2,2,2,9,85,4.73B000Q84G5Q,9SIA5AD45R8528,22-136-113,"western digital 250 gb caviar blue sata 3 gb/s 7200 rpm 8 mb cache bulk/oem desktop hard drive - wd2500aajs | 250gb 8mb 3.0gb/s 3.5"" internal bare",25.5,Internal Harddrives,western digital,5.8 x 4 x 1 inches 1.3 pounds 1.3 pounds     b000q84g5q wd2500aajssp 7025-01-607-3535 4.2 out of 5 stars may 4  2007 none none,wd2500aajs,92,391,10,3,1,16,70,4.33B000Q85WIQ,9SIAAEE4WT8534,22-136-111,"western digital blue wd5000aakb 500gb 7200 rpm 16mb cache ide ultra ata100 / ata-6 3.5"" internal hard drive bare drive | caviar 500 gb bulk packaging",125.22,Internal Harddrives,western digital,4 x 5.8 x 1 inches 1.3 pounds 1.4 pounds     item can be shipped within u.s. this item is not eligible for international shipping. b000q85wiq wd5000aakb 7025-01-580-6725 4.3 out of 5 stars september 14  2004 none none,wd5000aakb,28,424,11,7,4,7,71,4.2B000Q85WOK,9SIA5AD3SC2092,22-136-098,"western digital caviar blue wd3200aajs 320gb 7200 rpm 8mb cache sata 3.0gb/s 3.5"" internal hard drive bare drive | 320 gb bulk/oem 3.5 inch 8 mb ii",22.1,Internal Harddrives,western digital,5.8 x 4 x 1 inches 1.2 pounds 1.4 pounds     b000q85wok wd3200aajs 7025-01-623-2717 4.2 out of 5 stars may 4  2007 none none,wd3200aajs,363,891,13,3,3,13,68,4.2B000QD7B6W,9SIA0AJ30T2979,33-127-550,d-link dir-615 wireless n300 router  4-port switch  dd-wrt open source support | wireless-n,53.14,Wireless Routers,d-link,10.7 x 2.6 x 8.5 inches 9.3 ounces 1.5 pounds     b000qd7b6w dir-615 7025-01-601-5345 3.7 out of 5 stars july 7  2004 none none,dir-615,792,65,26,8,8,18,40,3.38B000TGK05A,9SIAAEE4U71198,19-115-027,intel core 2 quad q6700 kentsfield quad-core 2.66 ghz lga 775 95w bx80562q6700 processor | 8m l2 cache 1066mhz fsb lga775,263.5,CPUs,intel,6.2 x 6.7 x 3.9 inches 1.7 pounds 1.4 pounds     item can be shipped within u.s. this item is not eligible for international shipping. b000tgk05a bx80562q6700 4.7 out of 5 stars yes july 11  2007 none none,bx80562q6700,51,151,0,0,4,16,80,4.76B000UCELXK,9SIAAEE3VN6643,22-148-230,"seagate barracuda 7200.10 st3160815as 160gb 7200 rpm 8mb cache sata 3.0gb/s 3.5"" hard drive bare drive",17.05,Internal Harddrives,seagate,5.8 x 4 x 0.8 inches 14.1 ounces 1.1 pounds     item can be shipped within u.s. this item is not eligible for international shipping. b000ucelxk st3160815as 4.2 out of 5 stars december 19  2005 none none,st3160815as,122,199,7,2,8,21,62,4.29B000VMSZN6,9SIAAEE48J6992,22-144-309,"western digital caviar se wd2500jb 250gb 7200 rpm 8mb cache eide 3.5"" hard drive bare drive | udma/100 7200rpm ide hdd",22.99,Internal Harddrives,western digital,8.3 x 6.3 x 4.6 inches 1.4 pounds 1.4 pounds     wd b000vmszn6 wd2500jb 7025-01-536-2533 7025-01-538-4031 4.1 out of 5 stars september 1  2007 none none,wd2500jb,156,336,11,4,4,13,68,4.23B000VRZ7PA,9SIAAEE3XE0748,22-136-112,"western digital blue wd1600aajb 160gb 7200 rpm 8mb cache ide ultra ata100 / ata-6 3.5"" internal hard drive bare drive | wd 160 gb desktop 3.5 inch pata 8 mb -",25.84,Internal Harddrives,western digital,5.8 x 4 x 1 inches 15.2 ounces 1.2 pounds     b000vrz7pa wd1600aajb 7025-01-564-4643 4.3 out of 5 stars yes april 2  2004 none none,wd1600aajb,454,458,9,4,6,15,66,4.25B000VZ40CI,9SIA5AD3SC2092,22-136-098,"western digital caviar blue wd3200aajs 320gb 7200 rpm 8mb cache sata 3.0gb/s 3.5"" internal hard drive bare drive",22.42,Internal Harddrives,western digital,b000vz40ci 4.0 out of 5 stars 1 pounds     september 14  2004 320 gb 7025-01-623-2717 western digital wd3200aajs pc 15.5 ounces 5.8 x 1 x 4 inches 5.8 x 1 x 4 inches 7200 rpm,wd3200aajs,117,891,13,3,8,9,67,4.14B000WJCM9G,9SIA7M048J6656,23H-0002-00002,steelseries siberia v2 external usb sound card surround sound virtual audio interface 7.1 equalizer 3.5mm jack converter | white,15.49,Sound Cards,steelseries,10.6 x 9.4 x 4.7 inches 1.6 pounds 4.8 ounces steelseries b000wjcm9g item can be shipped within u.s. this item is not eligible for international shipping. 51001 2.8 out of 5 stars july 7  2004 none none,siberia,41,0,34,7,5,5,49,3.28B0010LTSHY,9SIA00Y0Z49606,26-262-060,jvc ha-nc250 3.5mm/ 6.3mm connector circumaural noise cancelling headphone | hanc250 wired connectivity - stereo,115.16,Headphones,jvc,7.9 x 2 x 9.8 inches 5.3 ounces 1.1 pounds     headphones -> headphones jvc b0010ltshy ha-nc250 1 aaa batteries required.  included  4.0 out of 5 stars june 22  2011 none none,ha-nc250,1,32,0,0,0,100,0,4B0010Z1W06,9SIA0AJ3396501,28-113-290,brother hl series hl-2140 personal up to 23 ppm monochrome laser printer,398.94,Laser Printers,brother,17.9 x 18.7 x 14.2 inches 15 pounds 18.2 pounds     currently  item can be shipped only within the u.s. and to apo/fpo addresses. for apo/fpo shipments  please check with the manufacturer regarding warranty and support issues. this item is not eligible for international shipping. b0010z1w06 for proposition 65 warning hl-2140 7025-01-592-2051 4.3 out of 5 stars december 7  2007 none none,hl-2140,396,271,10,4,5,15,66,4.23B00116SLYY,9SIA6393SE2172,1B4-00PR-000B5,refurbished  intel core 2 duo processor e8400 3.0ghz 6 mb cache socket lga775 desktop cpu | 3 ghz,32.47,CPUs,intel,6.7 x 6.1 x 3.9 inches 13.6 ounces 9.6 ounces     b00116slyy for proposition 65 warning bx80570e8400 4.4 out of 5 stars july 7  2004 none none,e8400,150,2,4,1,3,11,81,4.64B00116VHMC,9SIAAEE4M23216,19-115-043,intel core 2 quad q9300 yorkfield quad-core 2.5 ghz lga 775 95w bx80580q9300 processor | 6m l2 cache 1333mhz fsb lga775,114.98,CPUs,intel,6.5 x 6 x 4 inches 13.6 ounces 15.2 ounces item can be shipped within u.s. this item is not eligible for international shipping. b00116vhmc bx80580q9300 4.9 out of 5 stars december 13  2007 none none,bx80580q9300,15,229,0,0,0,13,87,4.87B0011A4UZE,9SIA4RE46N7250,20-148-160,crucial 4gb kit  2gbx2  ddr2 800mhz  pc2-6400  cl6 unbuffered udimm 240-pin desktop memory ct2kit25664aa800 / ct2cp25664aa800 | 2 x 2gb sdram 800 pc2 6400 dual channel model,36.79,Memory,crucial,b0011a4uze 4.5 out of 5 stars 1.4 ounces     september 14  2004 2 gb ddr2 800 mhz crucial crucial ct2kit25664aa800 pc 1.4 ounces 7 x 4 x 0.5 inches 7 x 4 x 0.5 inches green ddr2 sdram 1.8 volts,ct2kit25664aa800,841,161,3,2,3,12,80,4.64B0012WDMNC,9SIA6393S85425,1B4-00PR-00095,refurbished  intel core 2 quad processor q9550 2.83ghz 1333mhz 12mb 95w lga775 desktop cpu | 12 mb em64t bx80569q9550,71.95,CPUs,intel,b0012wdmnc 4.4 out of 5 stars 13.6 ounces july 7  2004 2.83 ghz intel core 2 quad 7025-01-575-9732 intel bx80569q9550 14.4 ounces 6.6 x 6 x 3.7 inches 6.6 x 6 x 3.7 inches intel 4 ddr2 sdram,q9550,128,1,2,2,3,12,81,4.68B0012Y0QT8,N82E16820134636,20-134-636,kingston 2gb 240-pin ddr2 sdram ddr2 800  pc2 6400  desktop memory model kvr800d2n6/2g | valueram 800mhz non-ecc cl6 dimm,21.49,Memory,kingston,6.9 x 2.2 x 0.5 inches 0.6 ounces 0.6 ounces     b0012y0qt8 kvr800d2n6/2g 5962-01-586-8315 4.6 out of 5 stars september 14  2004 none none,kvr800d2n6/2g,195,135,4,1,4,12,79,4.61B001342KM8,9SIA6504T18674,20-148-162,crucial 2gb single ddr2 800mhz  pc2-6400  cl6 sodimm 200-pin notebook memory module ct25664ac800 | so-dimm 800 pc2 6400 laptop model,21.6,Memory,crucial,b001342km8 4.7 out of 5 stars 0.3 ounces     september 14  2004 2048 mb ddr2 800 mhz crucial ct25664ac800 0.3 ounces 5.9 x 1.6 x 0.8 inches 5.91 x 1.57 x 0.79 inches 1 ddr2 sdram 1.8 volts,ct25664ac800,843,199,4,1,2,11,82,4.66B0013LO1GE,9SIA5AD2YK8509,22-148-294,"seagate barracuda es.2 st3500320ns 500gb 7200 rpm 32mb cache sata 3.0gb/s 3.5"" internal hard drive bare drive | st3500320ns. 500 gigabyte 3g enterprise storage",39.92,Internal Harddrives,seagate,4 x 5.8 x 1 inches 1.1 pounds 1.6 pounds     seagate b0013lo1ge st3500320ns 4.6 out of 5 stars july 7  2004 none none,st3500320ns,2,173,0,0,0,50,50,4.5B00153AMG8,N82E16817148035,17-148-035,apevia warlock power atx-wa750w 750w atx12v / eps12v sli ready crossfire ready power supply | internal - atx - ac 115/230 v - 750 watt,65.71,Power Supplies,apevia,5.9 x 5.9 x 3.4 inches 5 pounds 5.3 pounds     apevia corp. b00153amg8 atx-wa750w 3.1 out of 5 stars february 28  2008 none none,atx-wa750w,21,84,24,5,5,19,47,3.6B0015AFWD4,9SIA8UT5AW3674,26-159-150,sony mdr-e9lp/blk earbud headphones  black  discontinued by manufacturer  | - fashion - mdr-e10lp/blk,10.97,Headphones,sony,6 x 1.8 x 1.8 inches 0.8 ounces 1.4 ounces     sony b0015afwd4 item can be shipped within u.s. this item can be shipped to select countries outside of the u.s. mdr-e10lp/blk 3.8 out of 5 stars yes may 26  2006 none none,mdr-e10lp/blk,181,16,13,7,8,16,56,3.95B0016HLHQW,9SIA85V3SP4988,35-150-087,masscool 80mm ball cpu cooler 5f9001b1h3,16.67,CPU Fans and Heatsinks,masscool,4.2 x 3.5 x 3 inches 3.2 ounces 3.2 ounces     item can be shipped within u.s. this item is not eligible for international shipping. b0016hlhqw 5f9001b1h3 4.2 out of 5 stars april 2  2004 none none,5f9001b1h3,10,53,10,0,10,0,80,4.4B00180F402,9SIA8R64XX8426,12-189-056,link depot dvi-2-hdmi gold plated hdmi to dvi cable - 6 feet - oem - black | ft. m-m,6.83,HDMI Cables,link depot,11 x 7 x 1 inches 5.6 ounces 4 ounces     link depot b00180f402 item can be shipped within u.s. this item is not eligible for international shipping. imported  china  dvi-2-hdmi 3.2 out of 5 stars october 2  2001 none none,dvi-2-hdmi,42,351,21,10,7,7,55,3.65B0019L0X38,9SIA0AJ2YT4647,28-115-365,hp laserjet p2055dn ce459a workgroup up to 35 ppm monochrome laser printer,799.97,Laser Printers,hp,14.4 x 14.5 x 10.6 inches 23.6 pounds 30 pounds     b0019l0x38 ce459a 3.5 out of 5 stars july 7  2004 none none,ce459a,158,56,17,6,6,22,49,3.8