9SIA4RE5082093,Cyborg R.A.T. 3 Gaming Mouse,54,.99,17,Mad Catz,MCB4370300B2/04/1
N82E16826567011,COUGAR 550M RGB Pro FPS Gaming Mouse,43,.99,6,COUGAR,MOC550IG
N82E16826608018,ATRIX Benefit Orange LED MOUC16OLB 3 Buttons 1 x Wheel USB Wired Optical Gaming Mouse,6,.99,6,ATRIX,MOUC16OLB
9SIA4M553Z9576,MSI DS200 S12-0401170-EB5 Black & Red 9 Buttons 1 x Wheel USB Wired Mouse,45,.70,6,MSI,S12-0401170-EB5
9SIACS056T6735,ASUS ROG Sica 90MP00B1-B0UA00 Steel Grey 1 x Wheel USB Wired Optical Gaming Mouse,45,.00,6,ASUS,90MP00B1-B0UA00
9SIA4RE4T32733,Razer Diamondback Chroma RGB Laser Gaming Mouse,69,.99,6,RAZER,RZ01-01420100-R3U1
9SIA2F75BU4266,EVGA TORQ X3 902-X2-1032-KR 8 Buttons 1 x Wheel Wired Optical Gaming Mouse,24,.91,7,EVGA,902-X2-1032-KR
9SIA2F84BC9498,EVGA TORQ X5 902-X2-1052-KR White 8 Buttons 1 x Wheel Wired Optical Gaming Mouse,24,.14,7,EVGA,902-X2-1052-KR
9SIA4RE5086614,Mad Catz R.A.T.7 Gaming Mouse for PC and Mac - Red,126,.99,7,Mad Catz,MCB437080013/04/1
9SIA26R0PM4931,PC Mazer II 1600DPI Wired USB Gaming Optical Mouse for PC Mac,17,.48,7,e-3lue,9897005950239
9SIA4RE5091121,Mad Catz R.A.T.5 Gaming Mouse for PC and Mac - Gloss Black,109,.99,7,Mad Catz,MCB4370500C2/04/1
9SIA4RE4T22478,RAZER DeathAdder USB Gaming Mouse - World of Tanks Edition,74,.99,7,RAZER,RZ01-00840400-R3M1
9SIA4RE5086783,Mad Catz R.A.T.3 Optical Gaming Mouse for PC and Mac - Red,52,.99,7,Mad Catz,MCB437030013/04/1
9SIA1KT0UU6800,E-3lue E-blue Cobra II Mazer 2500DPI USB 2.4GHz Wireless Optical Gaming Mouse,19,.69,7,AGPtek,PC000004-BD
9SIA4RE4ZU4849,ROCCAT Kone Pure Military ROC-11-713 7 Buttons 1 x Wheel USB Wired Optical Core Performance Gaming Mouse - Desert Strike,79,.99,7,ROCCAT,ROC-11-713
9SIA4RE53D8187,Mad Catz R.A.T.TE Tournament Edition Gaming Mouse for PC and Mac - White,99,.99,7,Mad Catz,MCB437040001/04/1
9SIA4RE4ZU5124,SteelSeries World of Warcraft MMO Legendary Edition Mouse,46,.99,7,SteelSeries,62050
9SIA4RE23U5856,Sunsonny Lapop Cobra 6D Diamondback Optical USB Wired Professional Gaming Mouse,17,.29,7,Sunsonny Lapop,Sunsonny Cobra
9SIA4RE2576423,A4Tech X-710BK X7 Gaming Mouse,32,.99,7,A4Tech,X-710BK
9SIA9JN48E0061,SteelSeries Rival 100 Optical Gaming Mouse - Forged Red,38,.65,7,SteelSeries,62337
9SIA7HN50G3717,EVGA TORQ X3 902-X2-1032-KR 8 Buttons 1 x Wheel Wired Optical Gaming Mouse,16,.16,7,EVGA,902-X2-1032-KR
9SIA85V3RM6146,Azio EXO1-K Black 6 Buttons 1 x Wheel USB Wired Optical Gaming Mouse,33,.00,7,Azio,EXO1-K
9SIA1N852F7213,Mionix AVIOR 7000 000MIO7000A Black 9 Buttons 1 x Wheel USB Wired Optical Mouse,63,.29,7,Mionix,000MIO7000A
9SIA1GK34T0190,Redragon 16400DPI Adjustable USB Wired Gaming Mouse,36,.26,7,Redragon,M901
9SIA4RE4ZU4906,ROCCAT Kone Pure Military ROC-11-711 7 Buttons 1 x Wheel USB Wired Optical Core Performance Gaming Mouse - Camo Charge,69,.99,7,ROCCAT,ROC-11-711
9SIA4RE40E6730,SteelSeries Rival 100 Optical Gaming Mouse - Sakura Purple,41,.99,7,SteelSeries,62338
9SIAAWS59Z5376,Logitech MX518 Gaming Mouse 1800 dpi USB Wired Optical Mouse MX 518,36,.38,7,Logitech,MX 518
9SIA4RE54D3400,Tt eSPORTS THERON Infrared MO-TRN006DTM Black 8 Buttons 1 x Wheel USB Wired Optical Gaming Mouse,58,.99,7,Tt eSPORTS,MO-TRN006DTM
N82E16826249206,"SteelSeries Rival 700 Gaming Mouse, OLED Display, Tactile Alerts, 16000 CPI, Multicolor",84,.99,7,SteelSeries,62331
N82E16826816064,"Corsair Gaming M65 PRO RGB FPS Gaming Mouse, Backlit RGB LED, 12000 DPI, Optical, White",59,.99,7,Corsair,CH-9300111-NA
N82E16826608015,"Orange MOUC119NB, 2400 DPI Ergonomic High Precision LED Gaming Mouse With Side-control Buttons PRO-AIM Gaming Sensor",15,.99,7,Orange,MOUC119NB
9SIA4RE4NC5059,Refurbished: RAZER DeathAdder Chroma RZ01-01210100 Black 1 x Wheel USB Wired Optical Multi-color Ergonomic Gaming Mouse,38,.99,8,RAZER,RZ01-01210100
9SIA4RE23U5707,"RAJFOO i5 1600DPI 6D Optical Wired USB Gaming Mouse for Gamer PC Laptop Home Office User - Ergonomic Design, Comfortable Matte Finish",8,.48,8,RAJFOO,i5
9SIA4RE5086584,Mad Catz R.A.T.7 Gaming Mouse for PC and Mac - White,126,.99,8,Mad Catz,MCB4370800C1/04/1
9SIA9B54042471,"Cougar 600M Orange MOC600O 8200 dpi 16.8 Million Colors Gold Plated USB Laser Performance Gaming Mouse, 32bit ARM Processor 512KB On-Board Memory & UIX Interface System",64,.95,8,COUGAR,MOC600O
9SIA4RE4ZU4853,ROCCAT Lua USB Wired Optical Tri-Button Gaming Mouse,29,.99,8,ROCCAT,ROC-11-310
9SIAAKF3Z60379,Dream Machines DM1 Pro Gaming Mouse,44,.99,8,Dream Machines,DM1 Pro
N82E16826436032,ROCCAT Kone XTD USB Wired Optical Gaming Mouse,79,.99,8,ROCCAT,ROC-11-811
9SIA4RE4ZW6485,Refurbished: ROCCAT Tyon ROC-11-850 Black 14 Buttons 1 x Wheel USB 2.0 Wired Laser Gaming Mouse,76,.99,8,ROCCAT,ROC-11-850
9SIA4RE40J1071,Refurbished: RAZER Taipan Black 9 Buttons 1 x Wheel USB Wired Laser Mouse,49,.99,8,RAZER,None
9SIABW94WK0576,ZALMAN ZM-GM4 Custom Fit Black 8 Buttons USB Wired Laser 8200 dpi Gaming Mouse,61,.99,8,ZALMAN,ZM-GM4
9SIA9JN3RT3522,Razer DeathAdder Ergonomic PC Gaming Mouse,32,.25,8,RAZER,RZ01-00840100-R3U1
9SIA9JN41C0914,RAZER DeathAdder 3.5G Infrared Sensor Upgarde Edition Black Wired Optical Precision Gaming Mouse - Retail Packaging,32,.35,8,RAZER,DeathAdder
N82E16826436035,Refurbished: ROCCAT Lua ROC-11-310 1 x Wheel USB Wired Optical Gaming Mouse,10,.99,8,ROCCAT,ROC-11-310
N82E16826153185,Razer Mamba Chroma Gaming Mouse,109,.99,8,RAZER,RZ01-01360100-R3U1
9SIA4RE53D6525,Logitech G403 Prodigy Wired Optical Gaming Mouse,68,.99,8,Logitech,910-004796
9SIA1N83T49088,Razer Naga Chroma - Multi-color MMO Gaming Mouse,74,.56,8,RAZER,RZ01-01610100-R3U1
9SIA34T0ZV6694,Qisan Crotalus 2.4GHz Wireless Optical Gaming Mouse - Black,34,.20,9,Merdia,Crotalus Wireless Gaming Mouse
9SIA9JN3FR9243,Razer DeathAdder 3500 DPI Gaming Mouse Blue Light Right Hand,32,.25,9,RAZER,RZ01-01210100-R3U1
9SIA0AJ2ES4372,"Perixx PERIMICE-307B, High Performance Mouse - Wired USB - Black - Gaming Stylish Design - 3.93""x2.40""x1.34"" Dimension - Non-Programmable 5 Button - High Precision Blue LED - 800/1600 DPI Resolution",59,.95,9,Perixx,11016
9SIA4RE4T21803,E-3LUE Mazer II Type-R 2500DPI Usb Optical Professional Gaming Mouse for CS RAZER CF WOW GW2,16,.59,9,e-3lue,E3LUEMAZERII001
9SIA1KT14U5900,E-3lue E-Blue Mazer II 2500 DPI Blue LED 2.4GHz Wireless Optical Gaming Mouse,20,.69,9,e-3lue,E-3LUEMOUSE
9SIACDC54N6730,Zelotes Professional Up to 5500 DPI 7 Button 500Hz LED Optical USB Wired Gaming Mouse Mice Support Surface,12,.99,9,Zelotes,T80
9SIA4RE5475213,Corsair Gaming M65 RGB Laser Gaming Mouse - White,89,.99,9,Corsair,CH-9000110-NA
9SIA4RE5086999,Mad Catz M.M.O.TE Tournament Edition Gaming Mouse for PC,97,.99,9,Mad Catz,MCB437140002/04/1
N82E16826608017,"Orange MOUC146UWT, 2400 DPI Ergonomic High Precision LED Gaming Mouse With Side-control Buttons PRO-AIM Gaming Sensor",9,.99,9,Orange,MOUC146UWT
9SIA4RE2X62451,Qisan Crotalus USB 2.0 2000dpi Professional Optical Gaming Mouse Blue lED Design - Black (150cm-cable ),15,.79,10,Qisan,SBW9C1
9SIA4RE5085146,Mad Catz R.A.T.5 Gaming Mouse for PC and Mac - White,109,.99,10,Mad Catz,MCB437050001/04/1
9SIA4RE52E1296,E-3lue E-Blue Cobra II 1600DPI High Precision Pro Game Gaming Mouse for Windows Mac / BLUE,17,.89,10,e-3lue,cobra II
9SIA9JN48E0052,SteelSeries Rival 100 Optical Gaming Mouse - Proton Yellow,38,.65,10,SteelSeries,62340
9SIA4RE4ZW5502,ROCCAT Kone Pure Optical ROC-11-710 Black 7 Buttons USB Wired Optical Gaming Mouse,69,.99,10,ROCCAT,ROC-11-710
9SIA1ZZ34G7664,VicTake Professional LED Optical Wired 5500 DPI Game Mouse - 7 Buttons For Pro Game Notebook PC Laptop Computer,12,.99,10,VicTake,Victake 5500 DPI 7 buttons with scroll wheel 500Hz LED Optical USB Wired Gaming   Mouse Mice
9SIA1ZZ3RP8416,"VicTake 2.4G Wireless 7-Button Gaming Mouse w/ Adjustable DPI (800, 1200, 1600, 2000, 4800) - Black",16,.69,10,VicTake,None
9SIA9KW3NM3060,Logitech G500S Adjustable Weight Programmable 10 Buttons 1 x Wheel USB Wired Laser 200 - 8200 dpi Gaming Game Mouse,55,.89,10,Logitech,logitech G500s
N82E16826816054,Corsair Gaming M65 Laser Gaming Mouse - Black,49,.99,10,Corsair,CH-9000113-NA
9SIA4RE23U8154,YanDiao MX-9100 2400DPI 8D Iron Knight 6 Buttons Usb Optical Gaming Mouse with 4 Colors Respiration Leds,9,.87,11,YanDiao,MX-9100
9SIA4RE40J0940,Battlefield 4 Razer Taipan Ambidextrous PC Gaming Mouse,82,.49,11,RAZER,RZ01-00780200-R3U1
9SIA6YZ3RY8898,Tesoro Sagitta Spectrum H6L 5000 DPI 6 Programmable Key LED Illumination Lighting FPS/RTS Optical Gaming Mouse TS-H6L,59,.99,11,TESORO,TS-H6L
9SIA4RE5082094,Mad Catz R.A.T.3 Optical Gaming Mouse for PC and Mac -  Gloss Black,55,.99,11,Mad Catz,MCB4370300C2/04/1
N82E16826374001,"GAMDIAS Zeus GMS1100 Laser Unique Side Grip Calibration MMO RPG Gaming Mouse, 9 Programmable Buttons, 8200 DPI for PC, Adjustable Weight System",57,.93,11,GAMDIAS,GMS1100
9SIA26C1701648,A4Tech Bloody Ultra Gaming Gear R8A / R-Series Wireless Gaming Mouse,49,.99,11,A4Tech,R8A
9SIA3PC18A5449,JSCO™ JNL-101 Silent Quiet 96% Noiseless Click Button Wired Gaming Optical Mouse 1600 DPI,14,.99,11,JSCO™,JNL-101K
9SIA4RE2X62443,XinMeng XM-M398 7D 2000DPI Mamba 1St Gen. 6 Buttons Wired USB Optical Professional Gaming Mouse,16,.89,12,XinMeng,XM-M398
9SIA3TB1AM5433,E-3lue E-Blue Cobra II 1600DPI High Precision Pro Game Gaming Mouse for Windows Mac / BLACK,15,.00,12,e-3lue,cobra II
9SIA4RE4ZW6844,SteelSeries World of Warcraft Wireless MMO 62220 11 Buttons 1 x Wheel USB RF Wireless 8200 dpi Gaming Mouse,132,.99,12,SteelSeries,62220
N82E16826816068,"Corsair Gaming SCIMITAR PRO RGB Gaming Mouse, Backlit RGB LED, 16000 DPI, Black Side Panel, Optical",79,.99,12,Corsair,CH-9304111-NA
9SIA9JN3YD2245,Logitech G300S 910-004360 Black 9 Buttons 1 x Wheel USB Wired Optical Gaming Mouse,28,.99,12,Logitech,910-004360
9SIA1GK20R3340,Adjustable 2400DPI 6 Buttons Optical USB Wired Gaming Mouse LED for PC Laptop,8,.09,13,None,None
9SIA4RE40D9213,RAZER Abyssus 1800 Gaming Mouse and Goliathus (Speed) Mat Bundle,32,.69,13,RAZER,RZ84-00360200-B3U1
N82E16826123069,A4Tech V3 Black 7 Buttons 1 x Wheel USB Wired Optical Gaming Mouse,28,.99,13,A4Tech,V3
9SIA4RE40E8663,SteelSeries Rival 300 Gaming Mouse - White,47,.89,13,SteelSeries,62354
9SIA4RE40F0330,SteelSeries Rival 300 Gaming Mouse - Silver,47,.89,14,SteelSeries,62350
9SIA4RE4Y71068,"Xornet II Optical Precision Gaming Mouse with Full RGB Lighting, Customizable Buttons and Optimized for Claw Grip Users By Cooler Master",36,.99,14,COOLER MASTER,SGM-2002-KLON1
9SIA4RE5084825,Mad Catz R.A.T.TE Tournament Edition Gaming Mouse for PC and Mac -Matte Black,67,.99,14,Mad Catz,MCB437040002/04/1
N82E16826816069,"Corsair Gaming SCIMITAR PRO RGB Gaming Mouse, Backlit RGB LED, 16000 DPI, Yellow side panel, Optical",79,.99,14,Corsair,CH-9304011-NA
N82E16826816067,"Corsair Gaming HARPOON RGB Gaming Mouse, Backlit RGB LED, 6000 dpi, Optical",19,.99,14,Corsair,CH-9301011-NA
9SIA4M552Y7884,RAZER Naga USB MMO Gaming Mouse - Left-Handed Edition,72,.46,14,RAZER,RZ01-01050100-R3M1
9SIAA7658B8552,inland 07241 Red 6 Buttons 1 x Wheel USB 2.0 Wired Optical Gaming Mouse,15,.26,15,inland,07241
9SIA4S83H83423,COUGAR 600M RGB Pro FPS Gaming Mouse,73,.00,15,COUGAR,MOC600B
9SIA1ZZ3RP8413,"VicTake 2.4G Wireless 7-Button Gaming Mouse With Adjustable DPI (800, 1200, 1600, 2000, 4800) for Gamers - Black",16,.89,15,None,None
9SIA6ZP4X20583,Mionix NAOS 7000 000MIO7000M Black 7 Buttons 1 x Wheel USB 2.0 Wired Optical Gaming Mouse,63,.32,15,Mionix,000MIO7000M
9SIA1GK34T0113,"Redragon M601 CENTROPHORUS-2000 DPI Gaming Mouse for PC, 6 Buttons, Weight Tuning Set, Omron Micro Switches",14,.66,15,Redragon,M601
N82E16826816061,"Corsair Gaming Sabre RGB Gaming Mouse, Light Weight, 10000 DPI, Optical, Multi color",49,.99,15,Corsair,CH-9303011-NA
N82E16826785106,ASUS ROG Spatha RGB wireless/wired laser gaming mouse,146,.99,15,ASUS,90MP00A1-B0UA00
N82E16826249131,SteelSeries 62250 SENSEI Wireless Professional Laser Gaming Mouse,135,.37,15,SteelSeries,62250
N82E16826794008,SHARKOON Drakonia 000SKDM 11 Buttons USB 2.0 Wired Laser Gaming Mouse,39,.13,16,SHARKOON,000SKDM
N82E16826816055,"Corsair Gaming KATAR Gaming Mouse, Ambidextrous, Pro Player Modes, 8000 DPI, Backlit Red",37,.49,16,Corsair,CH-9000095-NA
9SIA4RE4UJ3822,SteelSeries Sensei RAW Heat Orange 62163 Black 7 Buttons 1 x Wheel USB Wired Laser Gaming Mouse,62,.99,17,SteelSeries,62163
9SIACC152H0304,Leap Motion LM-010 Motion controller,73,.99,17,Leap Motion,LM-010
9SIA4RE5472992,Corsair Gaming M65 RGB Laser Gaming Mouse - Black,102,.99,17,Corsair,CH-9000109-NA
9SIA4RE2VH0033,7 Buttons USB 800/1200/1600/2000 DPI Wired Gaming Optical Mouse,15,.79,18,None,None
9SIA6504VB7148,SteelSeries Diablo III 62151 Black 8 Buttons 1 x Wheel USB Wired Laser Gaming Mouse,87,.66,18,SteelSeries,62151
9SIA4RE5084556,Mad Catz R.A.T.9 Gaming Mouse for PC and Mac - Gloss Black,182,.99,18,Mad Catz,MCB4370900C2/02/1
N82E16826567002,COUGAR 700M Aluminum Pro Gaming Mouse - Silver,59,.99,18,COUGAR,MOC700S
9SIACB954S5862,"Refurbished: Logitech G502 Proteus Core Tunable Gaming Mouse with Fully Customizable Surface, Weight and Balance Tuning",54,.99,18,Logitech,910-004074
9SIA4RE5082089,Mad Catz R.A.T.9 Gaming Mouse for PC and Mac - Matte Black,199,.99,19,Mad Catz,MCB4370900B2/02/1
N82E16826608013,"Orange MOUC111NB, 2400 DPI Ergonomic High Precision LED Gaming Mouse With Side-control Buttons PRO-AIM Gaming Sensor",15,.99,19,Orange,MOUC111NB
N82E16826608014,"Orange MOUC126NB, 2400 DPI Ergonomic High Precision LED Gaming Mouse With Side-control Buttons PRO-AIM Gaming Sensor",9,.99,19,Orange,MOUC126NB
9SIA4RE31W3345,Logitech G302 Daedalus Prime Moba 910-004205 Black 6 Buttons 1 x Wheel USB Wired Delta Zero sensor Gaming Mouse,38,.89,20,Logitech,910-004205
N82E16826104938,Refurbished: Logitech G602 Black RF Wireless Optical Gaming Mouse (910-003820),34,.99,20,Logitech,910-003820
9SIA85V3DK6384,ZALMAN ZM-M400 Black 6 Buttons 1 x Wheel USB Wired Optical Gaming Mouse,25,.38,21,ZALMAN,ZM-M400
9SIA1ZZ3519789,Victake 6 Buttons Wireless Gaming Mouse - 5 DPI Switch (800/1200/ 1600/2000/2400) Adjustable with 2.4GWireless Transmission Long Battery Life for Professional Game Player/Game Fancier/Office,9,.99,21,Victake,CA57B
9SIA4RE4ZW4719,ROCCAT Savu Mid-Size USB Wired Gaming Mouse,76,.99,21,ROCCAT,ROC-11-600
9SIA24G3BB4748,Tt eSPORTS Talon Multi Colored USB Gaming Mouse,20,.87,21,Tt eSPORTS,MO-TLN-WDOOBK-01
9SIA1N84600757,ASUS ROG Gladius 90MP0081-B0UA00 Steel Grey 6 Buttons 1 x Wheel USB Wired Optical Gaming Mouse,65,.82,22,ASUS,90MP0081-B0UA00
9SIA9JN4167460,SteelSeries Rival 100 Optical Gaming Mouse - Black,33,.79,22,SteelSeries,62341
N82E16826554009,MSI Interceptor DS100 S12-0401130-EB5 Black & Red 7 Buttons 1 x Wheel USB Wired Laser Gaming Mouse,29,.99,23,MSI,S12-0401130-EB5
9SIA4RE2YV4416,Logitech G303 Daedalus Apex Performance Edition Gaming Mouse,49,.49,23,Logitech,910-004380
N82E16826608012,"Orange MMOUC122NB, 2400 DPI Ergonomic High Precision LED Gaming Mouse With Side-control Buttons PRO-AIM Gaming Sensor",9,.99,24,Orange,MOUC122NB
9SIA4RE3H69794,"A4Tech Patented V-Track Wired USB Gaming Mouse - 64K Memory, 3600 DPI, 6 Level-Shift - XI-747H/F4 Black",48,.79,27,A4Tech,XL-747H
9SIA4RE5473117,Corsair Raptor M30 USB Wired Gaming Mouse,59,.99,29,Corsair,CH-9000042-NA
9SIA4RE5084531,Mad Catz R.A.T.5 Gaming Mouse for PC and Mac - Matte Black,88,.99,29,Mad Catz,MCB4370500B2/04/1
N82E16826436024,ROCCAT Tyon All Action Multi-Button USB Gaming Mouse - Black,79,.99,29,ROCCAT,ROC-11-850-AM
9SIA4RE3H68672,A4Tech Patented V-Track Super-Precision 3000 DPI /1 MS 7-Button 5 Macros Mode Gaming Mouse - F3 Black,34,.59,30,A4Tech,F3
N82E16826816056,"Corsair Gaming SCIMITAR RGB MOBA/MMO Gaming Mouse, Black, Key Slider Mechanical Buttons, 12000 dpi, Multi color",71,.99,30,Corsair,CH-9000231-NA
9SIA4M55317412,Tt eSPORTS Level 10 M MO-LTM009DTJ Iron White 7 Buttons 1 x Wheel USB Wired Laser Gaming Mouse,62,.18,31,Tt eSPORTS,MO-LTM009DTJ
9SIA4RE5083743,Mad Catz R.A.T.7 Gaming Mouse for PC and Mac - Gloss Black,126,.99,31,Mad Catz,MCB4370800C2/04/1
9SIA9FT3RM0775,RAZER Naga Epic Chroma Gaming Mouse,126,.16,31,RAZER,RZ01-01230100-R3U1
9SIA1ZZ2EN2166,Victake ET X-08 Professional 2000DPI 2.4G Wireless Gaming Mouse For Google Android TV BOX Laptop PC - Red,14,.49,31,Victake,ET X-08 Professional 2000DPI 2.4G Wireless Gaming Mouse Mice for PC Laptop Red
9SIA1ZZ2EN2512,Victake 155984 Wireless 800-1200-1600-2000-2400 DPI Adjustable 2.4G Professional Gaming Mouse - Black,13,.99,32,Victake,155984
9SIA4RE2WD7013,Logitech G100s 910-003533 Black 1 x Wheel USB Wired Optical Gaming Mouse,22,.15,33,Logitech,910-003533
9SIA0ZX50C6237,COUGAR 700M Aluminum Pro Gaming Mouse - Black,71,.78,34,COUGAR,MOC700B
9SIA9JN43U1098,Logitech G900 Chaos Spectrum Professional Grade Wired/Wireless Gaming Mouse,149,.79,34,Logitech,910-004558
9SIA1ZZ3874224,"Victake Precision 8000 DPI Gaming Mouse - 6 Speed DPI Adjustment, 13 Light Modes, 8 Buttons, Optical Engine Power for Pro Gamer/Office - Black",16,.39,35,Victake,None
9SIA4RE4UJ4401,SteelSeries Sensei 62150 Grey 8 Buttons 1 x Wheel USB Wired Laser Gaming Mouse,72,.99,37,SteelSeries,62150
9SIA6U23S37984,Refurbished: Logitech G600 MMO Gaming Mouse 910-002864 Black 20 Buttons Tilt Wheel USB Wired Laser Mouse,83,.99,40,Logitech,910-002864
N82E16826567003,COUGAR 200M Optical LED Gaming Mouse,19,.99,40,COUGAR,MOC200B
N82E16826436015,ROCCAT Kone Pure USB Wired Laser Gaming Mouse - Black,65,.14,40,ROCCAT,ROC-11-700
9SIA4RE40E8620,SteelSeries Rival 300 Gaming Mouse - Black,47,.89,40,SteelSeries,62351
9SIA4RE4089532,CM Storm Havoc - High Performance 8200 DPI Laser Gaming Mouse with Extra Durable Omron Microswitches,99,.99,42,COOLER MASTER,SGM-4002-KLLN1
N82E16826816047,Corsair Gaming SCIMITAR RGB MOBA/MMO Gaming Mouse,79,.99,43,Corsair,CH-9000091-NA
9SIA4RE24X0340,"E-Blue Mazer II Wireless Optical Pro Gaming Mouse - AVAGO chip, 2500 DPI, Blue LED, 2.4GHz",23,.29,44,E-blue/e-3lue,Mazer II
N82E16826153184,RAZER Mamba Tournament Edition Chroma Gaming Mouse,74,.99,44,RAZER,RZ01-01370100-R3U1
9SIA49U34B4501,A4tech Bloody V8MA Ultra Gaming Gear Wired 8-Button Gaming Mouse,27,.99,45,A4Tech,V8MA
9SIA98C4R49685,MSI Interceptor DS B1 H01-0001711 Black 6 Buttons 1 x Wheel USB Wired Optical Gaming Mouse,18,.94,47,MSI,H01-0001711
9SIA4RE4AC6844,RAZER Naga Hex Wired USB Gaming Mouse - Red,82,.99,48,RAZER,RZ01-00750200-R3U1
N82E16826816063,"Corsair Gaming M65 PRO RGB FPS Gaming Mouse, Backlit RGB LED, 12000 DPI, Optical, Black",59,.99,48,Corsair,CH-9300011-NA
N82E16826146033,GIGABYTE GM-M6980X Black 9 Buttons Tilt Wheel USB Wired Pro-Laser Gaming Mouse,36,.99,49,GIGABYTE,GM-M6980X
9SIABB74AK2663,SteelSeries Sensei RAW 62155 Rubberized Black 8 Buttons 1 x Wheel USB Wired Laser Gaming Mouse,38,.50,50,SteelSeries,62155
9SIA4M55239415,Tt eSPORTS Level 10 M USB Laser Gaming Mouse - Diamond Black,62,.18,51,Tt eSPORTS,MO-LTM009DT
9SIA4RE5472975,Corsair Raptor M45 USB Wired Gaming Mouse,84,.99,51,Corsair,CH-9000052-NA
9SIA4RE4T20867,RAZER Orochi USB Gaming Mouse,88,.29,52,RAZER,RZ01-00820100-R3U1
N82E16826197148,Logitech G502 Proteus Spectrum RGB Tunable Gaming Mouse,59,.99,58,Logitech,910-004615
9SIA4RE4VN5367,Mionix NAOS 8200 000MIO8200M Black 7 Buttons 1 x Wheel USB 2.0 Wired Laser Gaming Mouse,96,.19,60,Mionix,000MIO8200M
9SIAC354SW7939,Logitech G402 910-004069 Black 8 Buttons 1 x Wheel USB Wired Optical Hyperion Fury FPS Gaming Mouse with High Speed Fusion Engine,44,.95,60,Logitech,910-004069
9SIA2J20SY0576,"Perixx MX-1000 Copper, Programmable Gaming Mouse - 7 Programmable Button & 5 User Profile - Avago A3050 Optical Sensor - DPI Switch 500-4000 - Compatible with Win 10",16,.99,63,Perixx,10819
9SIA9JN3S49152,Logitech G400s 910-003589 Black 8 Buttons 1 x Wheel USB Wired Optical Gaming Mouse,42,.65,63,Logitech,910-003589
9SIA1N83VM3569,EVGA TORQ X10 901-X1-1103-KR Wired Laser Gaming Mouse,32,.22,66,EVGA,901-X1-1103-KR
9SIA4RE3H29279,A4Tech V7MA Bloody Ultra Gaming Gear Wired 8-Button Gaming Mouse,37,.39,68,A4Tech,V7MA
9SIA4RE5082090,Mad Catz R.A.T.7 Gaming Mouse for PC and Mac,119,.99,71,Mad Catz,MCB4370800B2/04/1
9SIA9KW4EF3566,SteelSeries Rival Optical Gaming Mouse,46,.99,72,SteelSeries,62271
9SIA8HF3EJ6402,RAZER Imperator USB Wired Ergonomic Gaming Mouse,54,.99,76,RAZER,RZ01-00350200-R3U1
9SIA1N83U90796,EVGA TORQ X10 Carbon 901-X1-1102-KR Black 9 Buttons 1 x Wheel USB Wired Laser Gaming Mouse,37,.97,77,EVGA,901-X1-1102-KR
9SIA4RE3NX8388,Logitech G600MMO Gaming Mouse - White,62,.69,79,Logitech,910-002871
N82E16826465005,Azio GM2400 Black 6 Buttons 1 x Wheel Wired Optical LED Gaming Mouse,19,.99,80,Azio,GM2400
9SIA9JN3Z15568,RAZER DeathAdder USB Wired Gaming Mouse - Left-Hand Edition,57,.95,89,RAZER,RZ01-00151700-W1M1
9SIA24G28M4042,GIGABYTE GM-FORCE M7 5 Buttons 1 x Wheel USB Wired Optical Gaming Mouse,22,.33,89,GIGABYTE,GM-FORCE M7
N82E16826146031,GIGABYTE GM-FORCE M7 THOR Black 5 Buttons 1 x Wheel USB Wired Laser Gaming Mouse,36,.99,89,GIGABYTE,GM-FORCE M7 THOR
N82E16826146014,GIGABYTE GM-M8000X Rubber Black 9 Buttons 1 x Wheel USB Wired Laser Gaming Mouse,59,.95,90,GIGABYTE,GM-M8000X
9SIA4RE40J0906,RAZER Taipan USB Gaming Mouse - Black,77,.49,92,RAZER,RZ01-00780100-R3U1
N82E16826436016,ROCCAT Kone XTD USB Wired Laser Gaming Mouse,69,.99,93,ROCCAT,ROC-11-810
9SIA4RE4030767,RAZER Ouroboros Gaming Mouse,169,.99,99,RAZER,RZ01-00770300-R331
N82E16826977011,G.SKILL RIPJAWS MX780 USB Wired RGB Laser Gaming Mouse,49,.99,101,G.SKILL,GM-L8200CL8-MX780D10
9SIA4M55238982,Tt eSPORTS THERON MO-TRN006DT Black 1 x Wheel USB Wired Laser Gaming Mouse,47,.71,117,Tt eSPORTS,MO-TRN006DT
9SIA9JN3G82654,RAZER Abyssus RZ01-00360100-R3U1 Wired Optical High Precision Gaming Mouse - Black,21,.65,130,RAZER,RZ01-00360100-R3U1
9SIA2J20T19299,"Perixx MX-2000 IIB, Programmable Gaming Laser Mouse - Black - 8 Programmable Button - Weight Tuning Cartridge - Avago 5600DPI ADNS-9500 Laser Sensor",24,.99,131,Perixx,MX-2000II
9SIA9JN4293120,Razer Abyssus Mirror PC Gaming Mouse,22,.45,140,RAZER,RZ01-00360500-R3M1
9SIA4RE40B2534,Mionix Naos 3200 Black 7 Buttons 1 x Wheel USB 2.0 Wired LED-optical LED Gaming Mouse,53,.99,140,Mionix,Naos 3200
9SIA4RE38P6972,Logitech G602 910-003820 Black 11 Buttons 1 x Wheel USB RF Wireless Optical Gaming Mouse,57,.99,152,Logitech,910-003820
9SIA4RE31V5075,ZALMAN FG1000 Black 6 Buttons 1 x Wheel USB Wired 2000 dpi Gun Mouse,34,.99,171,ZALMAN,FG1000
9SIA4RE4T19832,RAZER Naga Hex Wired USB Gaming Mouse - Green,77,.69,184,RAZER,RZ01-00750100-R3U1
9SIA1JX30T6235,Logitech G700s 910-003584 Black 13 Buttons 1 x Wheel USB Wired / Wireless Laser Rechargeable Gaming Mouse,54,.00,185,Logitech,910-003584
9SIA2691JA6282,UtechSmart Venus 16400 DPI High Precision Laser MMO Gaming Mouse,38,.99,199,UtechSmart,US-D16400-GM
9SIA4RE4T19829,Razer Naga Epic Rechargable Wireless MMO PC Gaming Mouse,194,.99,212,RAZER,RZ01-00510100-R3U1
9SIA4RE4638548,RAZER DeathAdder Chroma USB Gaming Mouse,51,.29,223,RAZER,RZ01-01210100-R3U1
9SIA4RE4UB0316,RAZER Mamba Wireless Rechargeable Gaming Mouse,139,.99,239,RAZER,RZ01-00120400-R3U1
9SIA4RE40S1878,Razer Naga MMO Gaming Mouse,82,.99,244,RAZER,RZ01-01040100-R3U1
N82E16826104674,Logitech G600MMO Gaming Mouse - Black,49,.99,257,Logitech,910-002864
9SIA4RE5473003,Corsair M65 Vengeance USB Wired Laser Gaming Mouse,64,.99,315,Corsair,CH-9000022-NA
9SIA9JN3FY0108,Razer DeathAdder Ergonomic PC Gaming Mouse,41,.75,348,RAZER,RZ01-00840100-R3U1
9SIA4RE3NX8342,LOGITECH G502 Proteus Core Tunable Gaming Mouse,73,.49,400,Logitech,910-004074
N82E16826146009,GIGABYTE M6800 GM-M6800 Noble Black 4 Buttons 1 x Wheel USB Wired Optical Gaming Mouse,14,.99,"1,003",GIGABYTE,GM-M6800
