N82E16828113975,Brother HL-L6200DW Business Laser Printer with Wireless Networking and Duplex Printing,179,.99,4,Brother,HL-L6200DW
9SIA2F82K20337,Okidata B412DN Workgroup Up to 35 ppm Monochrome Laser Laser Printer,187,.45,1,Okidata,B412DN
9SIA1N83TV6236,Lexmark MX611DE Monochrome Multifunction Laser Printer,"1,499",.00,0,Lexmark,MX611de
9SIA9JA4NT2469,"Canon imageCLASS D1320 Monochrome Multifunction laser printer with Duplex printing, 35 ppm",799,.99,1,Canon,D1320
9SIA6TP2P34917,Refurbished: HP LaserJet Pro P1606DN Printer (CE749A),119,.95,1,HP,P1606DN
9SIA1UH52W8885,HP LaserJet Pro MFP M130fn (G3Q59A) Duplex 600 dpi x 600 dpi USB mono Laser MFP Printer,179,.39,1,HP,M130fn
9SIA4P03H83308,Dell Smart Printer S2810DN (1CX14) Duplex 1200 dpi x 1200 dpi USB / Wireless Mono Laser Printer,119,.99,1,Dell,S2810DN
N82E16828415936,"Refurbished: Hp Factory Recertified Color Laserjet Pro M177fw MFP 17/4 ppm 600 x 600 dpi 150-Sheet 128MB E-Print/Enet/USB/Wifi Color Laser Printer / Copier / Scanner / Fax W/ 3"" Touchscreen",244,.99,1,HP,M177fw
9SIABEY4B11318,HP LaserJet Enterprise M506dn (F2A69A) Duplex 1200 dpi x 1200 dpi USB / Ethernet Mono Laser Printer,555,.00,1,HP,M506dn
9SIA1N82KT4649,Xerox ColorQube 8580/N Color Solid Ink Printer,519,.22,1,Xerox,8580/N
9SIA61K3V17722,"Brother HL-L2320D Compact, Personal Monochrome Laser Printer with Duplex, Up to 30 ppm",109,.32,1,Brother,HL-L2320D
9SIA2F83RV4050,brother  HL-L2360DW  Workgroup  Up to 32 ppm  Monochrome  Wi Fi Direct  Laser  Printer with Wireless Networking and Duplex,165,.94,1,Brother,HL-L2360DW
9SIA9JA5990838,HP LaserJet M476nw (CF385A) Up to 21 ppm 600 x 600 dpi Wireless Color All-in-One Laser Printer,649,.99,1,HP,M476nw
N82E16828006536,Lexmark CS310N Color Laser Printer,287,.99,1,Lexmark,CS310n
9SIA1N84GW3492,DELL H625CDW (4MYG3) Duplex 600 dpi x 600 dpi wireless/USB color Laser MFP Printer,248,.00,1,Dell,H625CDW
9SIA6B34TF3477,HP LaserJet Pro M521dn (A8P79A) Duplex 1200 x 1200 dpi USB Monochrome Laser All-in-One Printer,,,1,HP,M521dn
N82E16828414471,HP LaserJet Pro M477fdn (CF378A) Duplex  38400 x 600 enhanced dpi USB / Ethernet Color Laser MFP Printer,379,.99,1,HP,M477fdn
N82E16828133824,Brother HL-L8250CDN Color Laser Printer with Networking and Duplex Printing,229,.99,1,Brother,HL-L8250CDN
N82E16828116135,Xerox WorkCentre 6605/DN Duplex 1200 dpi x 1200 dpi USB / Ethernet Color Laser MFC Printer,901,.27,1,Xerox,6605/DN
N82E16828115949,HP LaserJet Professional CP5225N (CE711A) Duplex 600 x 600 dpi USB / Ethernet Workgroup Color Laser Printer,,,1,HP,CP5225N
9SIA6AU56K5537,Brother MFC-L2720DW All-In-One Laser Printer with Wireless Networking and Duplex Printing,207,.90,1,Brother,MFC-L2720DW
9SIA1UH3719767,Samsung SL-M4070FR/XAA Monochrome Multifunction Laser Printer,390,.76,0,Samsung,SL-M4070FR/XAA
N82E16828414468,"HP LaserJet Pro M452nw (CF388A) Duplex 38,400 x 600 enhanced dpi Wireless / USB / Ethernet Color Laser Printer",249,.99,1,HP,M452nw
N82E16828414500,Refurbished: Hp Color Laserjet Pro M277dw(B3Q11AR#BGJ) MFP 19/19 ppm 600 x 600dpi 150-Sheet Duplex 256MB E-Print / Gbe / USB / Wifi Color Laser Printer / Copier / Scanner / Fax Factory Recertified,249,.99,1,HP,M277dw
N82E16828113984,Brother MFC Series MFC-L5900DW Duplex 1200 dpi x 1200 dpi wirelss/USB mono Laser MFC Printer,319,.99,1,Brother,MFC-L5900DW
9SIA2F83946023,Okidata B4600 (62446601) 600 x 2400 DPI USB / Parallel Monochrome Laser Printer - Black,233,.31,1,Okidata,B4600
N82E16828102712,"Canon imageCLASS D550 Monochrome Multifunction laser printer with Duplex printing, 26 ppm",,,1,Canon,D550
9SIA2F823C2780,Lexmark MS312dn Duplex 1200 dpi x 1200 dpi USB / Parallel / Ethernet Monochrome Laser Printer,149,.00,1,Lexmark,MS312dn
9SIA91J4687383,Lexmark MS811n 1200 x 1200 dpi USB/Ethernet Workgroup Monochrome Laser Printer,902,.43,2,Lexmark,MS811n
9SIA0AJ2NC8002,Lexmark MS310d Workgroup Up to 35 ppm Monochrome Laser Printer,299,.48,2,Lexmark,MS310d
9SIA0AJ5951726,Canon imageCLASS D1350 Monochrome Multifunction Laser Printer,899,.95,2,Canon,D1350
9SIA0AJ43K1027,Dell  3330DN  Workgroup  Up to 40 ppm 1200 x 1200 dpi Monochrome  Laser  Printer ,899,.95,2,Dell,3330DN
9SIA91N4D38582,OkiData B420dn Monochrome Laser Printer,502,.00,2,Okidata,B420dn
9SIABHV4GU0012,OKIDATA B4600 (120V) Personal Up to 27 ppm Mono LED Printer (62427201),319,.99,2,Okidata,B4600
9SIA19P4AN6291,HP LaserJet Enterprise 700 M775f (CC523A) Up to 30 ppm 600 x 600 dpi Duplex Color Laser MFP Printer,"4,899",.99,0,HP,M775f
9SIA6AU4SX4255,HP LaserJet Enterprise CP4025n (CC489A) Duplex 1200 x 1200 dpi USB / Ethernet Workgroup Color Laser Printer,"1,119",.00,2,HP,CP4025n
9SIA0AJ4UR2809,Refurbished: HP LaserJet Pro 300 M375NW MFC / All-In-One Up to 19 ppm 600 x 600 dpi Color Print Quality Color Wireless 802.11b/g/n Laser Printer,599,.48,2,HP,M375NW
9SIA6AU4SX4080,HP LaserJet Enterprise 500 MFP M575f (CD645A) Duplex Up to 31 ppm 1200 x 1200 dpi Color All-in-One Laser Printer,"2,598",.00,2,HP,MFP M575f
N82E16828006529,LEXMARK CX310dn MFC / All-In-One Color Laser Printers,567,.99,2,Lexmark,CX310dn
N82E16828142734,"Canon imageCLASS LBP7660Cdn Color laser printer with Duplex printing, 21 ppm",,,2,Canon,LBP7660Cdn
9SIA8H540G1641,Refurbished: Brother EHL-L2380DW Wireless Monochrome Laser Printer,134,.16,2,Brother,HL-L2380DW
9SIA2F823C2974,Lexmark CS410N Color Laser Printer,299,.00,2,Lexmark,CS410n
N82E16828006537,Lexmark CS310DN Color Laser Printer,374,.99,2,Lexmark,CS310dn
9SIA91J43P0494,Brother HL Series HL-3180CDW Duplex 600 dpi x 2400 dpi Wireless / USB Color Laser Printer,458,.24,2,Brother,HL-3180CDW
9SIA1N83SR8022,Dell H825CDW (P6M9H) Duplex 600 dpi x 600 dpi wireless/USB color Laser MFP Pirnter,299,.65,2,Dell,H825CDW
9SIA1UH40F6056,Brother MFC Series MFC-L6700DW Duplex 1200 dpi x 1200 dpi wirelss/USB mono Laser MFC Printer,571,.46,2,Brother,MFC-L6700DW
N82E16828116415,Xerox WorkCentre 3225/DNI Wireless Monochrome Multifunction Laser Printer,239,.99,2,Xerox,3225/DNI
9SIACB357G2524,"Canon imageCLASS MF726CDW wireless Color Multifunction laser printer with Duplex printing, 21 ppm",269,.99,2,Canon,MF726Cdw
N82E16828106829,Lexmark C925DE Color Laser Printer,"1,849",.99,2,Lexmark,24Z0000
9SIA1CZ2504045,Samsung Xpress SL-M2835DW/XAA Wireless Monochrome Laser Printer,139,.00,2,Samsung,SL-M2835DW/XAA
9SIA19P4AN7491,HP LaserJet Professional CP5225dn (CE712A) Duplex 600 x 600 dpi USB / Ethernet Color Laser Printer,"1,712",.72,2,HP,CP5225dn
9SIA4P02BT0843,Ricoh SP 213SNw 3-In-1 Monochrome Multifunction Wireless Laser Printer,79,.99,2,RICOH,SP 213SNw
9SIA6AU57E1352,HP LaserJet Enterprise M604dn (E6B68A) Up to 52 ppm 1200 dpi x 1200 dpi Duplex Monochrome Laser Printer,694,.00,2,HP,M604dn
N82E16828414469,"HP LaserJet Pro M452dw (CF394A) Duplex 38,400 x 600 enhanced dpi USB / Ethernet / Wireless Color Laser Printer",319,.99,2,HP,M452dw
N82E16828116009,Xerox WorkCentre 3315/DN Mono Duplex Multifunction Laser Printer,264,.99,2,Xerox,3315/DN
9SIA1N834M2467,Dell C1760NW Duplex up to 1200 dpi Image Quality wireless / USB color Laser Printer,119,.00,2,Dell,C1760NW
1EE-0005-006B9,HP Laserjet Enterprise M553n (B5L24A#BGJ) Duplex 1200 x 1200 dpi USB / Etherent Color Laser Printer,479,.99,2,HP,M553n
N82E16828414472,HP LaserJet Pro M477fdw (CF379A) Duplex 38400 dpi x 600 dpi USB color Laser MFP Printer,429,.99,2,HP,M477fdw
N82E16828414463,HP LaserJet Pro M402n (C5F93A) 4800 x 600 Enhance DPI USB Monochrome Laser Printer,169,.99,2,HP,M402n
9SIA3R84765520,Refurbished: Brother HL Series EHL-5250DN Workgroup Up to 30 ppm Monochrome Laser Printer,290,.00,3,Brother,EHL-5250DN
9SIA4P021P9884,Okidata MC562w (62441904) Up to 31 ppm 1200 x 600 dpi USB/Ethernet/Wi-Fi Color Duplex Multifunction Laser Printer,699,.99,0,Okidata,MC562w
9SIA0AJ2NC8003,Samsung SL-M2825DW/XAA Workgroup Up to 29 ppm Monochrome Wireless 802.11b/g/n Laser Printer,299,.95,3,Samsung,SL-M2825DW/XAA
9SIA2F823C5949,Brother MFC Series MFC-8220 Duplex 2400 dpi x 600 dpi USB mono Laser MFP Printer,293,.42,3,Brother,MFC-8220
9SIA3CF3NS9398,OkiData MB461 Monochrome Multifunction Laser Printer,329,.95,3,Okidata,MB461 MFP
9SIA3CF3UD1629,Canon imageCLASS MF4880dw Wireless Monochrome Multifunction Laser Printer,374,.40,0,Canon,MF4880dw
9SIA2F757X7117,HP LaserJet Pro M426fdw (F6W15A) Duplex Up to 4800 x 600 dpi USB / Ethernet / Wireless Monochrome Laser MFP Printer,375,.03,3,HP,M426fdw
9SIA0AJ3541451,HP Color LaserJet Enterprise CP4525dn CC494A Workgroup Up to 42 ppm 1200 x 1200 dpi Color Print Quality Color Laser Printer,"2,999",.95,3,HP,CC494A
9SIA6ZP3K32093,RICOH SP C250SF (407523) Duplex 2400 dpi x 600 dpi wireless/USB color Laser MFP Printer,259,.99,3,RICOH,SP C250SF
9SIA4P05AZ3550,Lexmark CS410DN Color Laser Printer,259,.99,3,Lexmark,CS410dn
9SIA9JA4G34497,HP LaserJet Pro 400 M451dw (CE958A) Duplex Up to 21 ppm 600 x 600 dpi Wireless Workgroup Color Laser Printer,789,.99,3,HP,M451dw
9SIACNF57Y3380,Refurbished: HP LaserJet Pro P1102w (CE658A#BGJ)19 ppm 600 x 600 dpi 160-Sheet 8 MB E-Print / USB / WIFI Mono Laser Printer Factory Recertified,119,.99,3,HP,P1102w
N82E16828118697,Xerox WorkCentre 6505/N Multi-function Color Laser Printer,499,.99,3,Xerox,6505/N
1EE-0005-006D5,Hp Laserjet Enterprise M553dn (B5L25A) Duplex up to 40 ppm USB / Ethernet Color Laser Printer,639,.99,3,HP,M553dn
1E4-0015-00153,HP LaserJet Pro M225DW (CF485A) Up to 26 ppm 1200 x 1200 dpi Duplex Wireless/USB Monochrome All-in-One Laser Printer,353,.99,3,HP,M225dw
N82E16828112550,Samsung Xpress SL-C1810W/XAA Wireless Color Laser Printer,179,.99,3,Samsung,SL-C1810W/XAA
9SIA0AJ55P9779,Brother DCP-8150DN High-Speed Laser Multi-Function Copier with Networking and Duplex Printing,599,.48,3,Brother,DCP-8150dn
9SIA61K44D5783,Samsung SL-C1860FW/XAA Up to 19 ppm Color Laser Laser Printer,389,.99,3,Samsung,SL-C1860FW/XAA
N82E16828112466,Samsung ProXpress SL-M3820DW/XAA Monochrome Wireless Laser Printer,199,.99,3,Samsung,SL-M3820DW/XAA
N82E16828414481,Refurbished: Hp Laserjet Pro M252dw(B4A22AR#BGJ) Printer Up to 19 ppm 600 x 600 dpi USB / /Wireless Duplex Color Laser Printer  Factory Recertified,159,.99,3,HP,M252dw
N82E16828414241,HP LaserJet Enterprise M604n (E6B67A) Simplex Up to 1200 x 1200 DPI USB Monochrome Laser Printer,,,3,HP,M604n
N82E16828414476,"HP LaserJet Pro M452dn (CF389A) Duplex 38,400 x 600 enhanced dpi USB / Ethernet Color Laser Printer",269,.99,3,HP,M452dn
N82E16828414464,HP LaserJet Pro M402dn (C5F94A) Duplex  600 x 600 dpi USB mono Laser Printer,199,.99,3,HP,M402dn
9SIA91J43P4751,Samsung CLX-6260FW Color Wireless Multifunction Laser Printer,654,.76,4,Samsung,CLX-6260FW
9SIA1N82KT4686,Xerox WorkCentre 6505/DN Duplex Multi-function Color Laser Printer,664,.53,4,Xerox,6505/DN
9SIA1N83Z86921,Samsung CLP-775ND Color Laser Printer,569,.55,4,Samsung,CLP-775ND
9SIA0AJ30T8899,Lexmark MS310dn Workgroup Up to 35 ppm Monochrome Laser Printer,319,.89,4,Lexmark,MS310dn
9SIA0AJ5190955,Brother HL Series HL-2240 Personal Up to 24 ppm 2400 x 600 dpi Color Print Quality Monochrome Laser Printer,399,.89,4,Brother,HL-2240
9SIA4X22SU9301,"Canon imageCLASS LBP6030W wireless Monochrome laser printer, 19 ppm",,,4,Canon,LBP6030w
9SIA1N82KT4648,Xerox ColorQube 8580/DN Color Solid Ink Printer,663,.10,4,Xerox,8580/DN
9SIA0AJ5951725,Brother MFC-8950DW High Speed All-In-One Laser Printer with Wireless Networking and Advanced Duplex Printing,899,.95,4,Brother,MFC-8950dw
N82E16828115560,"HP LaserJet Enterprise CP4025dn (CC490A) Duplex 1200 x 1200 dpi USB, Ethernet Color Laser Printer","1,280",.99,4,HP,CC490A
9SIA0AJ2TP4092,Refurbished: Brother DCP-7065DN Monochrome Multifunction Laser Printer,299,.89,4,Brother,EDCP-7065DN
N82E16828116008,Xerox Phaser 3320/DNI Duplex Wireless Mono Laser Printer,304,.99,4,Xerox,3320/DNI
9SIA91J4431170,Lexmark MX310dn (35S5700) Up to 35 ppm 1200 x 1200 dpi USB/Ethernet Monochrome Duplex Laser Printer,298,.22,4,Lexmark,MX310dn
9SIA1CZ3VU5214,Samsung SL-M2885FW/XAA Wireless Monochrome Multifunction Laser Printer,229,.00,4,Samsung,SL-M2885FW/XAA
9SIA6AU5528626,HP LaserJet Pro M177fw (CZ165A#BGJ) Duplex 600 x 600 dpi wireless/USB color Laser MFP Printer,249,.00,4,HP,M177fw
N82E16828113936,Brother DCP-L2520DW Laser Multi-Function Copier with Wireless Networking and Duplex Printing,129,.99,4,Brother,DCP-L2520dw
1EE-0005-006H9,HP LaserJet Pro M277DW (B3Q11A) Duplex up to 600 dpi Wireless/USB Color Laser MFP Printer,349,.99,4,HP,M277dw
N82E16828116414,Xerox WorkCentre 3215/NI Wireless Monochrome Multifunction Laser Printer,149,.99,4,Xerox,3215/NI
9SIA0AJ2MX3855,Canon imageCLASS MF4890dw Wireless Monochrome Multifunction Laser Printer,399,.89,5,Canon,MF4890dw
9SIA0AJ2TV1555,Brother MFC-9460CDN Color Multifunction Laser Printer,899,.89,5,Brother,MFC-9460CDN
9SIA0AJ54B3165,HP LaserJet M476dn (CF386A) Up to 21 ppm 600 x 600 dpi Duplex Color All-in-One Laser Printer,999,.48,5,HP,M476dn
9SIA0AJ2T83188,Brother MFC Series MFC-9325CW MFC / All-In-One Up to 19 ppm 600 x 2400 dpi Color Print Quality Color Wireless 802.11b/g/n Digital Color LED Printer,999,.95,5,Brother,MFC-9325CW
N82E16828116433,Xerox Phaser 6022/NI Wireless Color Laser Printer,229,.99,5,Xerox,None
9SIA9JA50P1068,HP LaserJet Pro M201dw (CF456A) Up to 26 ppm 1200 x 1200 dpi Duplex Wireless Monochrome Laser Printer,299,.99,5,HP,M201dw
N82E16828133822,Brother HL-L8350CDW Color Laser Printer with Wireless Networking and Duplex Printing,209,.99,5,Brother,HL-L8350CDW
N82E16828112578,Samsung Xpress C480FW (SL-C480FW/XAA) Wireless Multi-function Color Laser Printer,199,.99,5,Samsung,C480FW
9SIA61K5507243,Samsung Xpress SL-C460FW/XAA Color Wireless Multifunction Laser Printer,999,.99,6,Samsung,C460FW
9SIA6AU3P56011,"Canon imageCLASS MF216N Monochrome Multifunction laser printer, 24 ppm",299,.00,6,Canon,MF216n
9SIA1N82KX3966,Xerox Phaser 6600/DN Duplex 1200 dpi x 1200 dpi USB / Ethernet Color Laser Workgroup Printer,579,.33,6,Xerox,6600/DN
9SIA4P028U6190,Okidata C331dn (62443601) Up to 25 ppm 1200 x 600 dpi USB/Ethernet Color Duplex Laser Printer,269,.99,6,Okidata,C331dn
9SIA9JA4YH7163,Brother MFC-8510DN High Speed All-In-One Laser Printer with Networking and Duplex Printing,579,.99,6,Brother,MFC-8510DN
N82E16828116412,Xerox Phaser 3260/DI Wireless Duplex Monochrome Laser Printer,139,.99,6,Xerox,3260
N82E16828116434,Xerox WorkCentre 6027/NI Wireless Multi-function Color Laser Printer,299,.99,6,Xerox,6027/NI
9SIA0AJ27Z0241,Refurbished: Brother EHL-2270DW Compact Laser Printer with Wireless Networking and Duplex,289,.95,7,Brother,EHL-2270DW
9SIA0AJ58H2817,brother HL Series HL-4570CDW Workgroup Up to 30 ppm 2400 x 600 dpi Color Print Quality Color Wireless 802.11b/g/n Laser Printer,999,.89,7,Brother,HL-4570CDW
9SIA9JJ4FK5324,Brother HL-6180DW High Speed Single Function Laser Printer with Wireless Networking and Duplex Printing,639,.99,7,Brother,HL-6180DW
9SIA1UH3718535,LEXMARK CX410de 1200 x 1200 dpi USB/Ethernet All-In-One Color Laser Printer,798,.68,7,Lexmark,CX410de
9SIA4P01ZS0034,RICOH SP C250DN (407519) Duplex 2400 dpi x 600 dpi wireless/USB color Laser Printer,109,.99,7,RICOH,SP C250DN
N82E16828731011,Pantum P3225DN Duplex 1200 dpi x 600 dpi USB / Ethernet Monochrome Laser Printer,69,.99,7,Pantum,P3225DN
9SIA0AJ2NC7995,OKIDATA C530dn Workgroup Up to 31 ppm Color LED Network Printer (62435203),899,.95,8,Okidata,C530dn
9SIA4P01ZS5238,OkiData MC362w MFP Wireless Color Multifunction Laser Printer,349,.99,8,Oki,MC362w
9SIA0AJ2SC7525,HP LaserJet Pro 400 M401dn Workgroup Up to 35 ppm Monochrome Laser Printer,499,.89,8,HP,M401dn
9SIA9JA4Y61799,HP LaserJet Pro M127fw (CZ183A) Up to 21 ppm 600 x 600 dpi Monochrome USB/Ethernet/Wireless All-in-One Laser Printer,349,.99,8,HP,M127fw
9SIA3R84765515,Refurbished: Brother HL Series EHL-5240 Personal Up to 30 ppm Monochrome Laser Printer,299,.00,9,Brother,EHL-5240
9SIA0AJ2MX3854,HP LaserJet Pro 100 M175nw MFP Up to 17 ppm Up to 600 x 600 dpi Color Print Quality Color Wireless 802.11b/g/n Laser Printer,929,.95,9,HP,M175nw
9SIA9JA4KZ2360,Brother MFC-8710DW High Speed All-In-One Laser Printer with Wireless Networking and Duplex Printing,599,.99,9,Brother,MFC-8710DW
9SIA9JJ3HP2118,HP LaserJet Pro 400 M451nw (CE956A) 600 dpi x 600 dpi USB/Ethernet/Wireless Workgroup Color Laser Printer,697,.99,9,HP,M451nw
9SIA61K42T7279,Samsung SL-M2070FW/XAA Wireless Monochrome Multifunction Laser Printer,198,.99,9,Samsung,SL-M2070FW/XAA
9SIA9JJ3K04760,Samsung SCX-3405FW/XAC MFC / All-In-One Monochrome Printer,329,.99,10,Samsung,SCX-3405FW/XAC
9SIA0AJ55P9907,HP LaserJet Pro M127fn (CZ181A) Up to 21 ppm 600 x 600 dpi USB / Ethernet / Mobile Monochrome Laser All-in-One Printer,298,.48,10,HP,M127fn
1EE-0005-006B8,HP Laserjet Pro M252dw (B4A22A#BGJ) Duplex 600 x 600 DPI USB//Wireless/Ethernet Color Laser Printer,219,.99,10,HP,M252dw
9SIA9JA4W18097,HP LaserJet Pro 400 M451dn (CE957A) Duplex Up to 21 ppm 600 x 600 dpi Workgroup Color Laser Printer,649,.99,11,HP,M451dn
N82E16828113931,Brother MFC-L2740DW Duplex 2400 dpi x 600 dpi Wireless/USB Mono Laser MFC Printer,169,.99,11,Brother,MFC-L2740DW
N82E16828113908,Brother MFC-L8850CDW Duplex 2400 dpi x 600 dpi Wireless / USB Color Laser Printer,289,.99,11,Brother,MFC-L8850CDW
N82E16828113932,Brother MFC-L2700DW Duplex 2400 dpi x 600 dpi Wireless / USB / Ethernet Mono Laser MFC Printer,139,.99,12,Brother,MFC-L2700DW
9SIA0AJ2NC7993,HP LaserJet Pro M1217NFW Wireless Mono Laser Multifunction Printer Fax/Copy/Print/Scan 19PPM ePrinter USB2.0,659,.95,13,HP,M1217nfw
9SIA9JJ3YB3801,Brother HL-5470DW High Speed Single Function Laser Printer with Wireless Networking and Duplex Printing,439,.99,13,Brother,HL5470DW
9SIA9JJ4MH9169,Samsung Xpress C410W (SL-C410W/XAA) Duplex 2400 dpi x 600 dpi wireless/USB color Laser Printer,299,.99,13,Samsung,C410W
9SIA9JA4N43729,Brother MFC-8910DW High Speed All-In-One Laser Printer with Wireless Networking and Advanced Duplex Printing,689,.99,13,Brother,MFC8910DW
9SIA1CK4780434,Refurbished: Canon LBP6030W Up to 19 ppm 2400 x 600 dpi USB/Wireless Monochrome Printer- Grade A Like New,211,.89,14,Canon,LBP6030W
9SIA9JJ3RV4289,HP LaserJet Pro 400 M425dn (CF286A) Up to 35 ppm 1200 x 1200 dpi Duplex Workgroup Monochrome All-in-One Laser Printer,799,.99,14,HP,M425dn
N82E16828731005,Pantum P3255DN Duplex 1200 dpi x 1200 dpi USB Monochrome Laser Printer,79,.99,14,Pantum,P3255DN
9SIA9JJ4NW3654,Brother HL-3140CW Single Function Digital Color Printer with Wireless Networking,199,.90,14,Brother,HL-3140cw
N82E16828113934,Brother HL-L2300D Duplex 2400 dpi x 600 dpi USB Monochrome Laser Printer,69,.99,14,Brother,HL-L2300D
9SIA0AJ2MH2158,Canon LBP6200d Monochrome Laser Printer,169,.95,15,Canon,LBP6200d
9SIA0AJ2TP5250,brother HL-4150CDN Color Laser Printer with Duplex and Networking,849,.95,15,Brother,HL-4150CDN
9SIA4P05727179,Xerox Phaser 6500/DN Duplex Color Laser Printer,349,.00,16,Xerox,6500/DN
9SIA0AJ3FF5809,Canon Color imageCLASS MF8080Cw MFP Up to 12 ppm 2400 x 600 dpi Color Print Quality Color Wireless 802.11b/g/n Laser Printer,749,.95,17,Canon,MF8080Cw
9SIA9B55A49615,HP LaserJet P2035 (CE461A) Up to 30 ppm 600 x 600 dpi USB / Parallel Monochrome Laser Printer,339,.99,17,HP,P2035
N82E16828112465,Samsung ProXpress SL-M3320ND/XAA Monochrome Laser Printer,124,.99,17,Samsung,SL-M3320ND/XAA
N82E16828113851,Brother MFC-9330CDW Duplex 600 dpi x 2400 dpi Wireless / USB Color Laser MFC Printer,319,.99,17,Brother,MFC-9330CDW
9SIA0AJ2KT8040,Samsung SL-M2625D/XAC Monochrome Laser Printer,255,.48,18,Samsung,SL-M2625D/XAC
9SIA0AJ2X80693,Samsung CLP Series CLP-365W Workgroup Up to 19 ppm 2400 x 600 dpi Color Print Quality Color Wireless 802.11b/g/n Laser Printer,249,.89,18,Samsung,CLP-365W
9SIA24G1R18946,Samsung Xpress M2020W (SL-M2020W/XAA) Duplex 1200 dpi x 1200 dpi Wireless / USB Mono Laser Printer,89,.93,18,Samsung,M2020W
9SIA0AJ2MH2159,Samsung ML-2165W/XAC Wireless Monochrome Laser Printer,199,.89,19,Samsung,ML-2165W/XAC
9SIA4P02JS6218,Brother MFC-9130CW Digital Color All-In-One Laser Printer with Wireless Networking,279,.00,19,Brother,MFC-9130CW
9SIA85V4C72551,Pantum P2050 Duplex 1200 x 600 dpi USB Mono Laser Printer,63,.92,20,Pantum,P2050
9SIA9JJ3RV4285,HP LaserJet Pro 200 M251nw Up to 14 ppm 600 x 600 dpi Wireless Workgroup Color Laser Printer,429,.99,22,HP,color M251nw
9SIA0AJ2591738,Canon imageCLASS MF4770n Monochrome Multifunction Laser Printer,399,.89,23,Canon,MF4770n
9SIA9B54988403,Brother HL-5450DN High Speed Single Function Laser Printer with Networking and Duplex Printing,419,.99,23,Brother,HL-5450DN
9SIA9JJ3RA2353,HP LaserJet Pro 400 M401dne (CF399A) up to 35 ppm 1200 x 1200 dpi USB/Ethernet Duplex Workgroup Monochrome Laser Printer,589,.99,23,HP,M401dne
9SIA0AJ36G3160,Xerox Phaser 6010/N 600 x 600 dpi USB Color Laser Printer,689,.95,25,Xerox,6010/N
9SIA9JJ3X36894,Brother MFC-7360N Monochrome Multifunction Laser Printer,469,.89,25,Brother,MFC-7360N
9SIA9JA4UD4047,HP LaserJet Pro 400 M401n (CZ195A) Up to 35 ppm 1200 x 1200 dpi Monochrome Laser Printer,549,.99,26,HP,M401n
N82E16828113935,Brother HL-L2380DW Duplex 2400 dpi x 600 dpi USB / Wireless / Ethernet Mono Laser Printer,124,.99,27,Brother,HL-L2380DW
9SIA6EA4893053,"Canon imageCLASS D530 Monochrome Multifunction laser printer with Duplex printing, 26 ppm",,,30,Canon,D530
9SIABB74AK2833,Canon imageCLASS MF3010 Monochrome Multifunction Laser Printer,109,.00,30,Canon,MF3010
9SIA9JA4ZT4452,Canon imageCLASS MF227DW (ICMF227DW) Duplex 1200 dpi x 1200 dpi USB / Wireless / Ethernet Mono Laser MFC Printer,329,.99,31,Canon,MF227dw
1EE-0008-00094,Brother HL-L2340DW Duplex 2400 dpi x 600 dpi Wireless USB Mono Laser Printer,89,.99,31,Brother,HL-L2340DW
N82E16828112479,Samsung Xpress M2825DW (SL-M2825DW/XAC) Duplex 4800 x 600 DPI Wireless/USB Monochrome Laser Printer,79,.99,32,Samsung,M2825DW
9SIA0AJ2TS0303,HP LaserJet Pro P1606DN Workgroup Up to 26 ppm Monochrome Laser Printer,549,.89,34,HP,P1606DN
9SIA0AJ2MX3844,Brother MFC-7460DN Monochrome Multifunction Laser Printer,499,.95,36,Brother,MFC-7460DN
9SIA0AJ2978264,Samsung ML Series ML-2165W Workgroup Up to 21 ppm Monochrome Wireless 802.11b/g/n Laser Printer,149,.89,36,Samsung,ML-2165W
N82E16828113832,Brother HL-3170CDW Single Function Digital Color Printer with Wireless Networking and Duplex Printing,179,.99,36,Brother,Hl-3170cdw
9SIA9B54NC2845,Brother DCP-L2540DW Duplex 2400 x 600 dpi USB / Wireless / Ethernet Mono Laser MFC Printer,154,.95,43,Brother,DCP-L2540dw
9SIA0AJ24N0940,HP LaserJet Pro M1212nf MFP Up to 19 ppm Monochrome Laser Printer,799,.48,49,HP,M1212nf
9SIA4A02S21877,"Canon imageCLASS MF8280CW wireless Color Multifunction laser printer, 14 ppm",399,.99,49,Canon,MF8280CW
9SIA9JA4MJ7634,Brother MFC-7860DW Wireless Monochrome Multifunction Laser Printer,699,.99,52,Brother,MFC-7860DW
N82E16828118696,Xerox Phaser 6500/N Color Laser Printer,249,.99,54,Xerox,6500
9SIA0AJ2YT4647,HP LaserJet P2055dn CE459A Workgroup Up to 35 ppm Monochrome Laser Printer,"1,099",.95,56,HP,CE459A
9SIA0AJ3396512,HP LaserJet 1022 Q5912A Personal Up to 19 ppm Monochrome Laser Printer,899,.95,75,HP,Q5912A
9SIA9JJ48C0720,HP LaserJet Pro P1102w (CE658A) Duplex Up to 1200 dpi USB / Wireless Monochrome Laser Printer,287,.99,82,HP,P1102w
9SIA9JJ3N85842,Brother HL-2280DW Wireless Monochrome Multifunction Laser Printer,299,.90,83,Brother,HL-2280DW
9SIA0AJ2RS2704,Brother DCP-7065DN Monochrome Multifunction Laser Printer,299,.89,90,Brother,DCP-7065DN
9SIA0AJ3T48865,Brother HL-2240D Monochrome Laser Printer,359,.95,100,Brother,HL-2240D
9SIA0AJ2979865,HP LaserJet Pro P1102W CE657A Personal Up to 19 ppm Monochrome Laser Printer,279,.95,119,HP,CE657A
9SIA0AJ2660368,Canon ImageClass MF3240 0989B001 MFC / All-In-One Up to 21 ppm Monochrome Laser Printer,479,.95,150,Canon,0989B001
9SIA0AJ3396501,Brother HL Series HL-2140 Personal Up to 23 ppm Monochrome Laser Printer,499,.89,271,Brother,HL-2140
N82E16828731010,Pantum P2502W 1200 x 1200 DPI Wireless / USB Monochrome Laser Printer,49,.99,346,Pantum,P2502W
9SIA9JJ3H17350,Brother HL-2270DW Wireless Monochrome Laser Printer,244,.99,427,Brother,HL-2270DW
9SIA0AJ2TN3288,brother HL Series HL-2170W Workgroup Up to 23 ppm Monochrome Wireless Laser Printer,799,.95,528,Brother,HL-2170W
